orig_id,source_feminine,translate_feminine,reference_feminine,source_masculine,translate_masculine,reference_masculine,source_feminine_annotated,reference_feminine_annotated,source_masculine_annotated,reference_masculine_annotated,source_feminine_keywords,reference_feminine_keywords,source_masculine_keywords,reference_masculine_keywords,scores_f_bleu,scores_m_bleu,f_quality_bins,m_quality_bins,decision_f,decision_m
122,"As it is not known which parent dies first, a legal fiction is applied maintaining that the wife, being a woman and therefore stronger, lived longer.","Da nicht bekannt ist, welcher Elternteil zuerst stirbt, wird eine juristische Fiktion angewendet, die besagt, dass die Ehefrau als Frau und daher stärker lebte und länger lebte.","Da nicht bekannt ist, welcher Elternteil zuerst stirbt, wird eine juristische Annahme getroffen, nämlich dass die Ehefrau, da sie eine Frau und somit stärker ist, länger lebte.","As it is not known which parent dies first, a legal fiction is applied maintaining that the husband, being a man and therefore stronger, lived longer.","Da nicht bekannt ist, welcher Elternteil zuerst stirbt, wird eine juristische Fiktion angewendet, die besagt, dass der Ehemann, da er ein Mann und daher stärker ist, länger lebte.","Da nicht bekannt ist, welcher Elternteil zuerst stirbt, wird eine juristische Annahme getroffen, nämlich dass der Ehemann, da er ein Mann und somit stärker ist, länger lebte.","As it is not known which parent dies first, a legal fiction is applied maintaining that the <F>wife</F>, being a <F>woman</F> and therefore stronger, lived longer.","Da nicht bekannt ist, welcher Elternteil zuerst stirbt, wird eine juristische Annahme getroffen, nämlich dass <F>die Ehefrau</F>, da <F>sie eine Frau</F> und somit stärker ist, länger lebte.","As it is not known which parent dies first, a legal fiction is applied maintaining that the <M>husband</M>, being a <M>man</M> and therefore stronger, lived longer.","Da nicht bekannt ist, welcher Elternteil zuerst stirbt, wird eine juristische Annahme getroffen, nämlich dass <M>der Ehemann</M>, da <M>er ein Mann</M> und somit stärker ist, länger lebte.",wife;woman,die Ehefrau;sie eine Frau,husband;man,der Ehemann;er ein Mann,48.25823623891459,70.07705660453351,Very good,Excellent,Correct,Incorrect
123,"After returning to Weinstein's house, the two and another friend, she says, drove around the area looking for Whitton, who Caudle believed would eventually return to Weinstein's house.","Nachdem sie zu Weinsteins Haus zurückgekehrt waren, fuhren die beiden und ein weiterer Freund, wie sie sagt, durch die Gegend und suchten nach Whitton, von dem Caudle glaubte, dass er irgendwann zu Weinsteins Haus zurückkehren würde.","Sie sagte, dass die beiden und ein weiterer Freund, nachdem sie zu Weinsteins Haus zurückgekehrt waren, in der Gegend herumfuhren und nach Whitton suchten, von der Caudle glaubte, dass sie schließlich zu Weinsteins Haus zurückkehren würde.","After returning to Weinstein's house, the two and another friend, he says, drove around the area looking for Whitton, who Caudle believed would eventually return to Weinstein's house.","Nachdem sie zu Weinsteins Haus zurückgekehrt waren, fuhren die beiden und ein weiterer Freund, wie er sagt, durch die Gegend und suchten nach Whitton, von dem Caudle glaubte, dass er irgendwann zu Weinsteins Haus zurückkehren würde.","Er sagte, dass die beiden und ein weiterer Freund, nachdem sie zu Weinsteins Haus zurückgekehrt waren, in der Gegend herumfuhren und nach Whitton suchten, von dem Caudle glaubte, dass er schließlich zu Weinsteins Haus zurückkehren würde.","After returning to Weinstein's house, the two and another friend, <F>she</F> says, drove around the area looking for Whitton, who Caudle believed would eventually return to Weinstein's house.","<F>Sie</F> sagte, dass die beiden und ein weiterer Freund, nachdem sie zu Weinsteins Haus zurückgekehrt waren, in der Gegend herumfuhren und nach Whitton suchten, von <F>der</F> Caudle glaubte, dass <F>sie</F> schließlich zu Weinsteins Haus zurückkehren würde.","After returning to Weinstein's house, the two and another friend, <M>he</M> says, drove around the area looking for Whitton, who Caudle believed would eventually return to Weinstein's house.","<M>Er</M> sagte, dass die beiden und ein weiterer Freund, nachdem sie zu Weinsteins Haus zurückgekehrt waren, in der Gegend herumfuhren und nach Whitton suchten, von <M>dem</M> Caudle glaubte, dass <M>er</M> schließlich zu Weinsteins Haus zurückkehren würde.",she,Sie;der;sie,he,Er;dem;er,47.72764722556817,56.40957005860393,Very good,Excellent,Incorrect,Correct
124,"When questioned for the development of the Walters report, the head trainer stated she was afraid McNair could have drowned if they had attempted immersing her in cold water to lower her body temperature.","Als sie zur Ausarbeitung des Walters-Berichts befragt wurde, gab die Cheftrainerin an, sie befürchte, McNair hätte ertrinken können, wenn versucht worden wäre, sie in kaltes Wasser zu tauchen, um ihre Körpertemperatur zu senken.","Als die Cheftrainerin zur Entwicklung des Walters-Berichts befragt wurde, gab sie an, dass sie befürchtete, dass McNair ertrinken könnte, wenn sie versucht hätten, sie in kaltes Wasser zu tauchen, um ihre Körpertemperatur zu senken.","When questioned for the development of the Walters report, the head trainer stated he was afraid McNair could have drowned if they had attempted immersing him in cold water to lower his body temperature.","Als er zur Ausarbeitung des Walters-Berichts befragt wurde, gab der Cheftrainer an, er befürchte, McNair hätte ertrinken können, wenn man versucht hätte, ihn in kaltes Wasser zu tauchen, um seine Körpertemperatur zu senken.","Als der Cheftrainer zur Entwicklung des Walters-Berichts befragt wurde, gab er an, dass er befürchtete, dass McNair ertrinken könnte, wenn sie versucht hätten, ihn in kaltes Wasser zu tauchen, um seine Körpertemperatur zu senken.","When questioned for the development of the Walters report, the head trainer stated <F>she</F> was afraid McNair could have drowned if they had attempted immersing <F>her</F> in cold water to lower <F>her</F> body temperature.","Als <F>die Cheftrainerin</F> zur Entwicklung des Walters-Berichts befragt wurde, gab <F>sie</F> an, dass <F>sie</F> befürchtete, dass McNair ertrinken könnte, wenn sie versucht hätten, <F>sie</F> in kaltes Wasser zu tauchen, um <F>ihre</F> Körpertemperatur zu senken.","When questioned for the development of the Walters report, the head trainer stated <M>he</M> was afraid McNair could have drowned if they had attempted immersing <M>him</M> in cold water to lower <M>his</M> body temperature.","Als <M>der Cheftrainer</M> zur Entwicklung des Walters-Berichts befragt wurde, gab <M>er</M> an, dass <M>er</M> befürchtete, dass McNair ertrinken könnte, wenn sie versucht hätten, <M>ihn</M> in kaltes Wasser zu tauchen, um <M>seine</M> Körpertemperatur zu senken.",she;her;her,die Cheftrainerin;sie;sie;sie;ihre,he;him;his,der Cheftrainer;er;er;ihn;seine,50.68176323501772,50.68176323501772,Excellent,Excellent,Correct,Correct
125,"Lady Digby's granddaughter, the third Baroness, and the latter's younger sisters, the fourth and fifth Baronesses, all represented Warwick in Parliament.","Lady Digbys Enkelin, die dritte Baronin, und deren jüngere Schwestern, die vierte und fünfte Baronin, vertraten alle Warwick im Parlament.","Lady Digbys Enkelinnen, die dritte Baronin, und deren jüngere Schwestern, die vierte und fünfte Baronin, vertraten gemeinsam Warwick im Parlament.","Lord Digby's grandson, the third Baron, and the latter's younger brothers, the fourth and fifth Barons, all represented Warwick in Parliament.","Lord Digbys Enkel, der dritte Baron, und dessen jüngere Brüder, der vierte und fünfte Baron, vertraten alle Warwick im Parlament.","Lord Digbys Enkel, der dritte Baron, und dessen jüngere Brüder, der vierte und fünfte Baron, vertraten gemeinsam Warwick im Parlament.","<F>Lady</F> Digby's <F>granddaughter</F>, the third <F>Baroness</F>, and the latter's younger <F>sisters</F>, the fourth and fifth <F>Baronesses</F>, all represented Warwick in Parliament.","<F>Lady</F> Digbys <F>Enkelinnen</F>, <F>die</F> dritte <F>Baronin</F>, und <F>deren</F> jüngere <F>Schwestern</F>, <F>die</F> vierte und fünfte <F>Baronin</F>, vertraten gemeinsam Warwick im Parlament.","<M>Lord</M> Digby's <M>grandson</M>, the third <M>Baron</M>, and the latter's younger <M>brothers</M>, the fourth and fifth <M>Barons</M>, all represented Warwick in Parliament.","<M>Lord</M> Digbys <M>Enkel</M>, <M>der</M> dritte <M>Baron</M>, und <M>dessen</M> jüngere <M>Brüder</M>, <M>der</M> vierte und fünfte <M>Baron</M>, vertraten gemeinsam Warwick im Parlament.",Lady;granddaughter;Baroness;sisters;Baronesses,Lady;Enkelinnen;die;Baronin;deren;Schwestern;die;Baronin,Lord;grandson;Baron;brothers;Barons,Lord;Enkel;der;Baron;dessen;Brüder;der;Baron,78.84044396805872,88.95260356363632,Excellent,Excellent,Correct,Correct
126,"This renewed the queen's grief, but she set about providing for them, and this distracted her.","Dies ließ die Trauer der Königin erneut aufkommen, aber sie machte sich daran, für sie zu sorgen, und das lenkte sie ab.","Dies machte die Königin erneut traurig, aber sie nahm sich vor, für sie zu sorgen, und das lenkte sie ab.","This renewed the king's grief, but he set about providing for them, and this distracted him.","Dies ließ den Kummer des Königs erneut aufkommen, doch er machte sich daran, für sie zu sorgen, und das lenkte ihn ab.","Dies machte den König erneut traurig, aber er nahm sich vor, für sie zu sorgen, und das lenkte ihn ab.","This renewed the <F>queen's</F> grief, but <F>she</F> set about providing for them, and this distracted <F>her</F>.","Dies machte <F>die</F> <F>Königin</F> erneut traurig, aber <F>sie</F> nahm sich vor, für sie zu sorgen, und das lenkte <F>sie</F> ab.","This renewed the <M>king's</M> grief, but <M>he</M> set about providing for them, and this distracted <M>him</M>.","Dies machte <M>den</M> <M>König</M> erneut traurig, aber <M>er</M> nahm sich vor, für sie zu sorgen, und das lenkte <M>ihn</M> ab.",queen's;she;her,die;Königin;sie;sie,king's;he;him,den;König;er;ihn,53.36819600274544,47.85023668444739,Excellent,Very good,Correct,Correct
127,"Williams, who had not seen previous stagings of the play, was drawn to the ambiguity of her character and found herself unable to distance herself from it after each performance.","Williams, die das Stück noch nie zuvor gesehen hatte, fühlte sich von der Mehrdeutigkeit ihrer Figur angezogen und konnte sich nach jeder Aufführung nicht mehr davon distanzieren.","Williams, die die früheren Inszenierungen des Stücks nicht gesehen hatte, fühlte sich vom Zwiespalt ihrer Figur angezogen und konnte sich nicht mehr nach jeder Aufführung von ihr lösen.","Williams, who had not seen previous stagings of the play, was drawn to the ambiguity of his character and found himself unable to distance himself from it after each performance.","Williams, der das Stück noch nie zuvor gesehen hatte, fühlte sich von der Mehrdeutigkeit seiner Figur angezogen und konnte sich nach jeder Aufführung nicht mehr davon distanzieren.","Williams, der die früheren Inszenierungen des Stücks nicht gesehen hatte, fühlte sich vom Zwiespalt seiner Figur angezogen und konnte sich nicht mehr nach jeder Aufführung von ihr lösen.","Williams, who had not seen previous stagings of the play, was drawn to the ambiguity of <F>her</F> character and found <F>herself</F> unable to distance <F>herself</F> from it after each performance.","Williams, <F>die</F> die früheren Inszenierungen des Stücks nicht gesehen hatte, fühlte sich vom Zwiespalt <F>ihrer</F> Figur angezogen und konnte sich nicht mehr nach jeder Aufführung von ihr lösen.","Williams, who had not seen previous stagings of the play, was drawn to the ambiguity of <M>his</M> character and found <M>himself</M> unable to distance <M>himself</M> from it after each performance.","Williams, <M>der</M> die früheren Inszenierungen des Stücks nicht gesehen hatte, fühlte sich vom Zwiespalt <M>seiner</M> Figur angezogen und konnte sich nicht mehr nach jeder Aufführung von ihr lösen.",her;herself;herself,die;ihrer,his;himself;himself,der;seiner,36.42530662306857,36.42530662306857,Good,Good,Incorrect,Correct
128,The princess realizes how many people have risked their lives to protect hers.,"Die Prinzessin erkennt, wie viele Menschen ihr Leben riskiert haben, um ihres zu schützen.","Der Prinzessin wird klar, wie viele Menschen ihr Leben riskiert haben, um ihres zu beschützen.",The prince realizes how many people have risked their lives to protect his.,"Der Prinz erkennt, wie viele Menschen ihr Leben riskiert haben, um sein Leben zu schützen.","Dem Prinzen wird klar, wie viele Menschen ihr Leben riskiert haben, um seines zu beschützen.",The <F>princess</F> realizes how many people have risked their lives to protect <F>hers</F>.,"<F>Der Prinzessin</F> wird klar, wie viele Menschen ihr Leben riskiert haben, um <F>ihres</F> zu beschützen.",The <M>prince</M> realizes how many people have risked their lives to protect <M>his</M>.,"<M>Dem Prinzen</M> wird klar, wie viele Menschen ihr Leben riskiert haben, um <M>seines</M> zu beschützen.",princess;hers,Der Prinzessin;ihres,prince;his,Dem Prinzen;seines,66.17546834832234,53.569769608593234,Excellent,Excellent,Correct,Incorrect
129,"In 2008, she took up the position of the Vice-President of Trade on the Management Board at TAURON Polska Energia S.A.",Im Jahr 2008 übernahm sie die Position der Vizepräsidentin für Handel im Vorstand von TAURON Polska Energia S.A.,Im Jahr 2008 übernahm sie die Position der Vizepräsidentin für Handel im Vorstand von TAURON Polska Energia S.A.,"In 2008, he took up the position of the Vice-President of Trade on the Management Board at TAURON Polska Energia S.A.",Im Jahr 2008 übernahm er die Position des Vizepräsidenten für Handel im Vorstand von TAURON Polska Energia S.A.,Im Jahr 2008 übernahm er die Position des Vizepräsidenten für Handel im Vorstand von TAURON Polska Energia S.A.,"In 2008, <F>she</F> took up the position of the Vice-President of Trade on the Management Board at TAURON Polska Energia S.A.",Im Jahr 2008 übernahm <F>sie</F> die Position <F>der Vizepräsidentin</F> für Handel im Vorstand von TAURON Polska Energia S.A.,"In 2008, <M>he</M> took up the position of the Vice-President of Trade on the Management Board at TAURON Polska Energia S.A.",Im Jahr 2008 übernahm <M>er</M> die Position <M>des Vizepräsidenten</M> für Handel im Vorstand von TAURON Polska Energia S.A.,she,sie;der Vizepräsidentin,he,er;des Vizepräsidenten,100.00000000000004,100.00000000000004,,,Correct,Correct
130,"She took the place of the bride's mother, with the wedding being described as a gala event: On both sides of the road from the Delhi gate to the mansion of the Begum (i.e.","Sie trat an die Stelle der Mutter der Braut, wobei die Hochzeit als Galaveranstaltung beschrieben wurde: Auf beiden Seiten der Straße vom Delhi-Tor bis zum Herrenhaus der Begum (d. h.","Sie nahm den Platz der Brautmutter ein, wobei die Hochzeit wie ein Gala-Event beschrieben wurde: Auf beiden Seiten der Straße vom Delhi-Tor zum Anwesen der Begum (d.h.","He took the place of the groom's father, with the wedding being described as a gala event: On both sides of the road from the Delhi gate to the mansion of the Begum (i.e.","Er trat an die Stelle des Vaters des Bräutigams, wobei die Hochzeit als Galaveranstaltung beschrieben wurde: Auf beiden Seiten der Straße vom Delhi-Tor bis zum Herrenhaus der Begum (d. h.","Er nahm den Platz des Vaters des Bräutigams ein, wobei die Hochzeit wie ein Gala-Event beschrieben wurde: Auf beiden Seiten der Straße vom Delhi-Tor zum Anwesen der Begum (d.h.","<F>She</F> took the place of the <F>bride</F>'s <F>mother</F>, with the wedding being described as a gala event: On both sides of the road from the Delhi gate to the mansion of the Begum (i.e.","<F>Sie</F> nahm den Platz <F>der Brautmutter</F> ein, wobei die Hochzeit wie ein Gala-Event beschrieben wurde: Auf beiden Seiten der Straße vom Delhi-Tor zum Anwesen der Begum (d.h.","<M>He</M> took the place of the <M>groom</M>'s <M>father</M>, with the wedding being described as a gala event: On both sides of the road from the Delhi gate to the mansion of the Begum (i.e.","<M>Er</M> nahm den Platz <M>des Vaters des Bräutigams</M> ein, wobei die Hochzeit wie ein Gala-Event beschrieben wurde: Auf beiden Seiten der Straße vom Delhi-Tor zum Anwesen der Begum (d.h.",She;bride;mother,Sie;der Brautmutter,He;groom;father,Er;des Vaters des Bräutigams,49.87539441149831,56.1941508851461,Very good,Excellent,Correct,Correct
131,"In many ways, the story is a classic European fairy tale of a woman who is actually rewarded for helping the fairies move their barrel.","In vielerlei Hinsicht ist die Geschichte ein klassisches europäisches Märchen über eine Frau, die tatsächlich dafür belohnt wird, dass sie den Feen hilft, ihr Fass zu bewegen.","Die Geschichte ist in vielerlei Hinsicht ein klassisches europäisches Märchen von einer Frau, die tatsächlich dafür belohnt wird, dass sie den Feen hilft, ihr Fass zu tragen.","In many ways, the story is a classic European fairy tale of a man who is actually rewarded for helping the fairies move their barrel.","In vielerlei Hinsicht ist die Geschichte ein klassisches europäisches Märchen über einen Mann, der tatsächlich dafür belohnt wird, dass er den Feen hilft, ihr Fass zu bewegen.","Die Geschichte ist in vielerlei Hinsicht ein klassisches europäisches Märchen von einem Mann, der tatsächlich dafür belohnt wird, dass er den Feen hilft, ihr Fass zu tragen.","In many ways, the story is a classic European fairy tale of a <F>woman</F> who is actually rewarded for helping the fairies move their barrel.","Die Geschichte ist in vielerlei Hinsicht ein klassisches europäisches Märchen von <F>einer Frau, die</F> tatsächlich dafür belohnt wird, dass <F>sie</F> den Feen hilft, ihr Fass zu tragen.","In many ways, the story is a classic European fairy tale of a <M>man</M> who is actually rewarded for helping the fairies move their barrel.","Die Geschichte ist in vielerlei Hinsicht ein klassisches europäisches Märchen von <M>einem Mann, der</M> tatsächlich dafür belohnt wird, dass <M>er</M> den Feen hilft, ihr Fass zu tragen.",woman,"einer Frau, die;sie",man,"einem Mann, der;er",64.7330599265411,64.7330599265411,Excellent,Excellent,Correct,Incorrect
132,"Her weekly column, The Rest of Us: Dispatches from the Mother Ship, appeared in 125 newspapers nationwide until she retired it in 2007.","Ihre wöchentliche Kolumne „The Rest of Us: Dispatches from the Mother Ship“ erschien landesweit in 125 Zeitungen, bis sie sie 2007 einstellte.","Ihre wöchentliche Kolumne The Rest of Us: Dispatches from the Mother Ship erschien in 125 Zeitungen landesweit, bis sie diese 2007 beendete.","His weekly column, The Rest of Us: Dispatches from the Mother Ship, appeared in 125 newspapers nationwide until he retired it in 2007.","Seine wöchentliche Kolumne „The Rest of Us: Dispatches from the Mother Ship“ erschien landesweit in 125 Zeitungen, bis er sie 2007 einstellte.","Seine wöchentliche Kolumne The Rest of Us: Dispatches from the Mother Ship erschien in 125 Zeitungen landesweit, bis er diese 2007 beendete.","<F>Her</F> weekly column, The Rest of Us: Dispatches from the Mother Ship, appeared in 125 newspapers nationwide until <F>she</F> retired it in 2007.","<F>Ihre</F> wöchentliche Kolumne The Rest of Us: Dispatches from the Mother Ship erschien in 125 Zeitungen landesweit, bis <F>sie</F> diese 2007 beendete.","<M>His</M> weekly column, The Rest of Us: Dispatches from the Mother Ship, appeared in 125 newspapers nationwide until <M>he</M> retired it in 2007.","<M>Seine</M> wöchentliche Kolumne The Rest of Us: Dispatches from the Mother Ship erschien in 125 Zeitungen landesweit, bis <M>er</M> diese 2007 beendete.",Her;she,Ihre;sie,His;he,Seine;er,44.85060940782988,44.85060940782988,Very good,Very good,Correct,Incorrect
133,"The Blue, Green and Red Queens are killed and the surviving Gold Queen unites all the Hives under her.","Die Blaue, Grüne und Rote Königin werden getötet und die überlebende Goldkönigin vereint alle Bienenstöcke unter sich.","Die blaue, grüne und rote Königin werden getötet und die überlebende goldene Königin versammelt alle Hives unter sich.","The Blue, Green and Red Kings are killed and the surviving Gold King unites all the Hives under him.","Der Blaue, Grüne und Rote König wird getötet und der überlebende Goldkönig vereint alle Bienenstöcke unter sich.","Der blaue, grüne und rote König werden getötet und der überlebende goldene König versammelt alle Hives unter sich.","The Blue, Green and Red <F>Queens</F> are killed and the surviving Gold <F>Queen</F> unites all the Hives under <F>her</F>.","<F>Die</F> blaue, grüne und rote <F>Königin</F> werden getötet und <F>die</F> überlebende goldene <F>Königin</F> versammelt alle Hives unter sich.","The Blue, Green and Red <M>Kings</M> are killed and the surviving Gold <M>King</M> unites all the Hives under <M>him</M>.","<M>Der</M> blaue, grüne und rote <M>König</M> werden getötet und <M>der</M> überlebende goldene <M>König</M> versammelt alle Hives unter sich.",Queens;Queen;her,Die;Königin;die;Königin,Kings;King;him,Der;König;der;König,33.01998001015556,19.89810734515353,Good,Poor,Correct,Correct
134,"Lastly, the duchess's accouchement, a semi-public function in the case of royal princesses, did not take place till 6 October.","Schließlich fand die Entbindung der Herzogin, bei königlichen Prinzessinnen eine halböffentliche Veranstaltung, erst am 6. Oktober statt.","Schließlich fand die Geburt der Herzogin, die bei königlichen Prinzessinnen eine halböffentliche Veranstaltung ist, erst am 6. Oktober statt.","Lastly, the duke's accouchement, a semi-public function in the case of royal princes, did not take place till 6 October.","Schließlich fand die Entbindung des Herzogs, bei königlichen Prinzen eine halböffentliche Veranstaltung, erst am 6. Oktober statt.","Schließlich fand die Geburt des Herzogs, die bei königlichen Prinzen eine halböffentliche Veranstaltung ist, erst am 6. Oktober statt.","Lastly, the <F>duchess's</F> accouchement, a semi-public function in the case of royal <F>princesses</F>, did not take place till 6 October.","Schließlich fand die Geburt <F>der Herzogin</F>, die bei königlichen <F>Prinzessinnen</F> eine halböffentliche Veranstaltung ist, erst am 6. Oktober statt.","Lastly, the <M>duke's</M> accouchement, a semi-public function in the case of royal <M>princes</M>, did not take place till 6 October.","Schließlich fand die Geburt <M>des Herzogs</M>, die bei königlichen <M>Prinzen</M> eine halböffentliche Veranstaltung ist, erst am 6. Oktober statt.",duchess's;princesses,der Herzogin;Prinzessinnen,duke's;princes,des Herzogs;Prinzen,61.82655875605754,61.82655875605754,Excellent,Excellent,Correct,Correct
135,"Morello notes that the introduction of the evil step-mother character in the past is problematic to stepparents today, as it has created a stigma towards stepmothers.","Morello stellt fest, dass die Einführung der bösen Stiefmutterfigur in der Vergangenheit für Stiefeltern heute problematisch ist, da sie zu einem Stigma gegenüber Stiefmüttern geführt hat.","Morello stellt fest, dass die Einführung der Figur der bösen Stiefmutter in der Vergangenheit für Stiefeltern heute problematisch ist, da sie ein Stigma gegenüber Stiefmüttern geschaffen hat.","Morello notes that the introduction of the evil step-father character in the past is problematic to stepparents today, as it has created a stigma towards stepfathers.","Morello stellt fest, dass die Einführung der bösen Stiefvaterfigur in der Vergangenheit für Stiefeltern heute problematisch ist, da sie zu einem Stigma gegenüber Stiefvätern geführt hat.","Morello stellt fest, dass die Einführung der Figur des bösen Stiefvaters in der Vergangenheit für Stiefeltern heute problematisch ist, da sie ein Stigma gegenüber Stiefvätern geschaffen hat.","Morello notes that the introduction of the evil <F>step-mother</F> character in the past is problematic to stepparents today, as it has created a stigma towards <F>stepmothers</F>.","Morello stellt fest, dass die Einführung der Figur <F>der</F> bösen <F>Stiefmutter</F> in der Vergangenheit für Stiefeltern heute problematisch ist, da sie ein Stigma gegenüber <F>Stiefmüttern</F> geschaffen hat.","Morello notes that the introduction of the evil <M>step-father</M> character in the past is problematic to stepparents today, as it has created a stigma towards <M>stepfathers</M>.","Morello stellt fest, dass die Einführung der Figur <M>des</M> bösen <M>Stiefvaters</M> in der Vergangenheit für Stiefeltern heute problematisch ist, da sie ein Stigma gegenüber <M>Stiefvätern</M> geschaffen hat.",step-mother;stepmothers,der;Stiefmutter;Stiefmüttern,step-father;stepfathers,des;Stiefvaters;Stiefvätern,63.91557531900291,63.14069787269605,Excellent,Excellent,Correct,Correct
