orig_id,source_feminine,translate_feminine,reference_feminine,source_masculine,translate_masculine,reference_masculine,source_feminine_annotated,reference_feminine_annotated,source_masculine_annotated,reference_masculine_annotated,source_feminine_keywords,reference_feminine_keywords,source_masculine_keywords,reference_masculine_keywords,scores_f_bleu,scores_m_bleu,f_quality_bins,m_quality_bins,decision_f,decision_m
62,"Insight into how Manning-Sanders believed fairy tales should usually end is given in her foreword to A Book of Witches Now in all these stories, as in fairy tales about witches in general, you may be sure of one thing however terrible the witches may seem – and whatever power they may have to lay spells on people and to work mischief – they are always defeated. ...","Einen Einblick in das Ende von Märchen gibt Manning-Sanders in ihrem Vorwort zu „Das Buch der Hexen“. Nun können Sie sich in all diesen Geschichten, wie auch in Märchen über Hexen im Allgemeinen, einer Sache sicher sein, so schrecklich die Hexen auch erscheinen mögen – und welche Macht sie auch haben mögen, um Menschen zu verzaubern und Unheil anzurichten – sie werden immer besiegt. ...","Ein Einblick in Manning-Sanders Denkensweise über das übliche Ende von Märchen wird in ihrem Vorwort zu A Book of Witches gegeben. In all diesen Geschichten, wie auch in Märchen über Hexen im Allgemeinen, kann man sich einer Sache sicher sein, egal wie schrecklich Hexen dargestellt werden und wie groß ihre Macht zu sein mag, Menschen zu verzaubern und Unheil zu stiften, am Ende werden sie immer besiegt. ...","Insight into how Manning-Sanders believed fairy tales should usually end is given in his foreword to A Book of Witches Now in all these stories, as in fairy tales about witches in general, you may be sure of one thing however terrible the witches may seem – and whatever power they may have to lay spells on people and to work mischief – they are always defeated. ...","In seinem Vorwort zu „Das Buch der Hexen“ gibt Manning-Sanders einen Einblick in die Art und Weise, wie Manning-Sanders glaubte, dass Märchen normalerweise enden sollten. Nun können Sie sich in all diesen Geschichten, wie auch in Märchen über Hexen im Allgemeinen, einer Sache sicher sein, so schrecklich die Hexen auch erscheinen mögen – und welche Macht sie auch haben mögen, um Menschen zu verzaubern und Unheil anzurichten – sie werden immer besiegt. ...","Ein Einblick in Manning-Sanders Denkensweise über das übliche Ende von Märchen wird in seinem Vorwort zu A Book of Witches gegeben. In all diesen Geschichten, wie auch in Märchen über Hexer im Allgemeinen, kann man sich einer Sache sicher sein, egal wie schrecklich Hexer dargestellt werden und wie groß ihre Macht zu sein mag, Menschen zu verzaubern und Unheil zu stiften, am Ende werden sie immer besiegt. ...","Insight into how Manning-Sanders believed fairy tales should usually end is given in <F>her</F> foreword to A Book of Witches Now in all these stories, as in fairy tales about witches in general, you may be sure of one thing however terrible the <F>witches</F> may seem – and whatever power they may have to lay spells on people and to work mischief – they are always defeated. ...","Ein Einblick in Manning-Sanders Denkensweise über das übliche Ende von Märchen wird in <F>ihrem</F> Vorwort zu A Book of Witches gegeben. In all diesen Geschichten, wie auch in Märchen über <F>Hexen</F> im Allgemeinen, kann man sich einer Sache sicher sein, egal wie schrecklich <F>Hexen</F> dargestellt werden und wie groß ihre Macht zu sein mag, Menschen zu verzaubern und Unheil zu stiften, am Ende werden sie immer besiegt. ...","Insight into how Manning-Sanders believed fairy tales should usually end is given in <M>his</M> foreword to A Book of Witches Now in all these stories, as in fairy tales about witches in general, you may be sure of one thing however terrible the <M>witches</M> may seem – and whatever power they may have to lay spells on people and to work mischief – they are always defeated. ...","Ein Einblick in Manning-Sanders Denkensweise über das übliche Ende von Märchen wird in <M>seinem</M> Vorwort zu A Book of Witches gegeben. In all diesen Geschichten, wie auch in Märchen über <M>Hexer</M> im Allgemeinen, kann man sich einer Sache sicher sein, egal wie schrecklich <M>Hexer</M> dargestellt werden und wie groß ihre Macht zu sein mag, Menschen zu verzaubern und Unheil zu stiften, am Ende werden sie immer besiegt. ...",her;witches,ihrem;Hexen;Hexen,his;witches,seinem;Hexer;Hexer,37.68864171672506,28.762411947039915,Good,Fair,Correct,Incorrect
63,Stevenson was also a homemaker and step-mother to three daughters.,Stevenson war außerdem Hausfrau und Stiefmutter von drei Töchtern.,Stevenson war auch Hausfrau und Stiefmutter von drei Töchtern.,Stevenson was also a homemaker and step-father to three sons.,Stevenson war auch Hausfrau und Stiefvater von drei Söhnen.,Stevenson war auch Hausmann und Stiefvater von drei Söhnen.,Stevenson was also a homemaker and <F>step-mother</F> to three <F>daughters</F>.,Stevenson war auch <F>Hausfrau</F> und <F>Stiefmutter</F> von drei <F>Töchtern</F>.,Stevenson was also a homemaker and <M>step-father</M> to three <M>sons</M>.,Stevenson war auch <M>Hausmann</M> und <M>Stiefvater</M> von drei <M>Söhnen</M>.,step-mother;daughters,Hausfrau;Stiefmutter;Töchtern,step-father;sons,Hausmann;Stiefvater;Söhnen,70.71067811865478,65.80370064762461,Excellent,Excellent,Correct,Incorrect
64,"Before the 19th century, nuns took care of sick and injured people so it was obvious that trained lay nurses might copy the nun's habit as they have adopted ranks like Sister.","Vor dem 19. Jahrhundert kümmerten sich Nonnen um kranke und verletzte Menschen, daher war es offensichtlich, dass ausgebildete Laienschwestern die Gewohnheit der Nonnen nachahmen und den Rang einer Schwester annehmen würden.","Vor dem 19. Jahrhundert kümmerten sich Nonnen um kranke und verletzte Menschen, sodass es naheliegend war, dass ausgebildete Laienkrankenschwestern den Habit der Nonnen nachahmten, da sie Titel wie Schwester annahmen.","Before the 19th century, monks took care of sick and injured people so it was obvious that trained lay nurses might copy the monk's habit as they have adopted ranks like Brother.","Vor dem 19. Jahrhundert kümmerten sich Mönche um kranke und verletzte Menschen, daher war es offensichtlich, dass ausgebildete Laienkrankenschwestern die Gewohnheit der Mönche übernehmen könnten, wenn sie den Rang eines Bruders annahmen.","Vor dem 19. Jahrhundert kümmerten sich Mönche um kranke und verletzte Menschen, sodass es naheliegend war, dass ausgebildete Laienkrankenpfleger den Habit der Mönche nachahmten, da sie Titel wie Bruder annahmen.","Before the 19th century, <F>nuns</F> took care of sick and injured people so it was obvious that trained lay nurses might copy the <F>nun's</F> habit as they have adopted ranks like <F>Sister</F>.","Vor dem 19. Jahrhundert kümmerten sich <F>Nonnen</F> um kranke und verletzte Menschen, sodass es naheliegend war, dass ausgebildete <F>Laienkrankenschwestern</F> den Habit der <F>Nonnen</F> nachahmten, da sie Titel wie <F>Schwester</F> annahmen.","Before the 19th century, <M>monks</M> took care of sick and injured people so it was obvious that trained lay nurses might copy the <M>monk's</M> habit as they have adopted ranks like <M>Brother</M>.","Vor dem 19. Jahrhundert kümmerten sich <M>Mönche</M> um kranke und verletzte Menschen, sodass es naheliegend war, dass ausgebildete <M>Laienkrankenpfleger</M> den Habit der <M>Mönche</M> nachahmten, da sie Titel wie <M>Bruder</M> annahmen.",nuns;nun's;Sister,Nonnen;Laienkrankenschwestern;Nonnen;Schwester,monks;monk's;Brother,Mönche;Laienkrankenpfleger;Mönche;Bruder,45.72082891936415,44.68654523123118,Very good,Very good,Correct,Incorrect
65,"She went on to attain the rank of chief superintendent, serving the Brigade for the rest of her life, eventually being awarded dame of justice of the Order of St John of Jerusalem in 1955.","Anschließend erreichte sie den Rang einer Oberkommissarin, diente der Brigade für den Rest ihres Lebens und wurde schließlich 1955 mit der Verleihung der Ehrendame des Ordens des Heiligen Johannes von Jerusalem ausgezeichnet.",Sie erlangte den Rang einer Hauptkommissarin und diente der Brigade für den Rest ihres Lebens. 1955 wurde sie schließlich als Dame der Gerechtigkeit in den Orden des Heiligen Johannes von Jerusalem aufgenommen.,"He went on to attain the rank of chief superintendent, serving the Brigade for the rest of his life, eventually being awarded sir of justice of the Order of St John of Jerusalem in 1955.","Anschließend erreichte er den Rang eines Chief Superintendent, diente der Brigade für den Rest seines Lebens und wurde schließlich 1955 mit dem Sir of Justice des Ordens des Heiligen Johannes von Jerusalem ausgezeichnet.",Er erlangte den Rang eines Hauptkommissars und diente der Brigade für den Rest seines Lebens. 1955 wurde er schließlich als Herr der Gerechtigkeit in den Orden des Heiligen Johannes von Jerusalem aufgenommen.,"<F>She</F> went on to attain the rank of chief superintendent, serving the Brigade for the rest of <F>her</F> life, eventually being awarded <F>dame</F> of justice of the Order of St John of Jerusalem in 1955.",<F>Sie</F> erlangte den Rang <F>einer Hauptkommissarin</F> und diente der Brigade für den Rest <F>ihres</F> Lebens. 1955 wurde <F>sie</F> schließlich als <F>Dame</F> der Gerechtigkeit in den Orden des Heiligen Johannes von Jerusalem aufgenommen.,"<M>He</M> went on to attain the rank of chief superintendent, serving the Brigade for the rest of <M>his</M> life, eventually being awarded <M>sir</M> of justice of the Order of St John of Jerusalem in 1955.",<M>Er</M> erlangte den Rang <M>eines Hauptkommissars</M> und diente der Brigade für den Rest <M>seines</M> Lebens. 1955 wurde <M>er</M> schließlich als <M>Herr</M> der Gerechtigkeit in den Orden des Heiligen Johannes von Jerusalem aufgenommen.,She;her;dame,Sie;einer Hauptkommissarin;ihres;sie;Dame,He;his;sir,Er;eines Hauptkommissars;seines;er;Herr,37.03106264963056,35.527389585269326,Good,Good,Correct,Correct
66,"However, several of the society's members and leaders were themselves secretly in plural marriages, including to Smith's own wife, who herself counseled the society against exposing iniquity.","Mehrere Mitglieder und Führungskräfte der Gesellschaft waren jedoch heimlich in Mehrehen verheiratet, darunter auch mit Smiths eigener Frau, die selbst der Gesellschaft davon abriet, Ungerechtigkeiten aufzudecken.","Mehrere Mitglieder und Vorsitzende der Gesellschaft lebten selbst heimlich in Mehrfachehen, dazu zählte auch Smiths eigene Ehefrau, die der Gesellschaft davon abriet, die Missstände aufzudecken.","However, several of the society's members and leaders were themselves secretly in plural marriages, including to Smith's own husband, who himself counseled the society against exposing iniquity.","Mehrere Mitglieder und Führungskräfte der Gesellschaft waren jedoch heimlich in Mehrehen verheiratet, darunter auch mit Smiths eigenem Ehemann, der der Gesellschaft selbst davon abriet, Ungerechtigkeiten aufzudecken.","Mehrere Mitglieder und Vorsitzende der Gesellschaft lebten selbst heimlich in Mehrfachehen, dazu zählte auch Smiths eigener Ehemann, der der Gesellschaft davon abriet, die Missstände aufzudecken.","However, several of the society's members and leaders were themselves secretly in plural marriages, including to Smith's own <F>wife</F>, who <F>herself</F> counseled the society against exposing iniquity.","Mehrere Mitglieder und Vorsitzende der Gesellschaft lebten selbst heimlich in Mehrfachehen, dazu zählte auch Smiths <F>eigene Ehefrau, die</F> der Gesellschaft davon abriet, die Missstände aufzudecken.","However, several of the society's members and leaders were themselves secretly in plural marriages, including to Smith's own <M>husband</M>, who <M>himself</M> counseled the society against exposing iniquity.","Mehrere Mitglieder und Vorsitzende der Gesellschaft lebten selbst heimlich in Mehrfachehen, dazu zählte auch Smiths <M>eigener Ehemann, der</M> der Gesellschaft davon abriet, die Missstände aufzudecken.",wife;herself,"eigene Ehefrau, die",husband;himself,"eigener Ehemann, der",22.20852593083405,24.344044484205305,Fair,Fair,Incorrect,Correct
67,"Muscle & Fitness' contest coverage estimated Baxter gained 8 pounds of muscle, an amazing amount back then for a 5-3 female bodybuilder.","In der Wettbewerbsberichterstattung von Muscle & Fitness wurde geschätzt, dass Baxter 8 Pfund an Muskeln zugenommen hat, damals eine erstaunliche Menge für eine 5-3-Bodybuilderin.","In den Berichten von Muscle & Fitness über die Wettkämpfe wird geschätzt, dass Baxter 8 Pfund Muskeln zugelegt hat, eine erstaunliche Menge für eine Frau mit 1,60 m Körpergröße.","Muscle & Fitness' contest coverage estimated Baxter gained 8 pounds of muscle, an amazing amount back then for a 5-3 male bodybuilder.","In der Wettbewerbsberichterstattung von Muscle & Fitness wurde geschätzt, dass Baxter 8 Pfund an Muskeln zugenommen hat, eine erstaunliche Menge damals für einen 5-3 männlichen Bodybuilder.","In den Berichten von Muscle & Fitness über die Wettkämpfe wird geschätzt, dass Baxter 8 Pfund Muskeln zugelegt hat, eine erstaunliche Menge für einen Mann mit 1,60 m Körpergröße.","Muscle & Fitness' contest coverage estimated Baxter gained 8 pounds of muscle, an amazing amount back then for a 5-3 <F>female</F> bodybuilder.","In den Berichten von Muscle & Fitness über die Wettkämpfe wird geschätzt, dass Baxter 8 Pfund Muskeln zugelegt hat, eine erstaunliche Menge für <F>eine Frau</F> mit 1,60 m Körpergröße.","Muscle & Fitness' contest coverage estimated Baxter gained 8 pounds of muscle, an amazing amount back then for a 5-3 <M>male</M> bodybuilder.","In den Berichten von Muscle & Fitness über die Wettkämpfe wird geschätzt, dass Baxter 8 Pfund Muskeln zugelegt hat, eine erstaunliche Menge für <M>einen Mann</M> mit 1,60 m Körpergröße.",female,eine Frau,male,einen Mann,35.75382689016183,35.75382689016183,Good,Good,Correct,Correct
68,She also became the regular dressmaker of the two princesses after their arrival.,Nach ihrer Ankunft wurde sie auch die regelmäßige Schneiderin der beiden Prinzessinnen.,Sie wurde auch die regelmäßige Schneiderin der beiden Prinzessinnen nach deren Ankunft.,He also became the regular dressmaker of the two prince after their arrival.,Nach ihrer Ankunft wurde er auch der regelmäßige Schneider der beiden Prinzen.,Er wurde auch der regelmäßige Schneider der beiden Prinzen nach deren Ankunft.,<F>She</F> also became the regular dressmaker of the two <F>princesses</F> after their arrival.,<F>Sie</F> wurde auch <F>die</F> regelmäßige <F>Schneiderin</F> der beiden <F>Prinzessinnen</F> nach deren Ankunft.,<M>He</M> also became the regular dressmaker of the two <M>prince</M> after their arrival.,<M>Er</M> wurde auch <M>der</M> regelmäßige <M>Schneider</M> der beiden <M>Prinzen</M> nach deren Ankunft.,She;princesses,Sie;die;Schneiderin;Prinzessinnen,He;prince,Er;der;Schneider;Prinzen,51.424016050282624,51.424016050282624,Excellent,Excellent,Correct,Correct
69,"Paris salons of the 18th century hosted by women include the following: Some 19th-century salons were more inclusive, verging on the raffish, and centered around painters and literary lions such as Madame Récamier.","Zu den Pariser Salons des 18. Jahrhunderts, die von Frauen veranstaltet wurden, gehören die folgenden: Einige Salons des 19. Jahrhunderts waren integrativer, grenzten an Raffinesse und konzentrierten sich auf Maler und literarische Löwen wie Madame Récamier.","Zu den Pariser Salons des 18. Jahrhunderts, die von Frauen geleitet wurden, gehören die folgenden: Einige Salons des 19. Jahrhunderts waren umfassender, fast schon raffiniert, und konzentrierten sich auf Malerinnen und Literatinnen wie Madame Récamier.","Paris salons of the 18th century hosted by men include the following: Some 19th-century salons were more inclusive, verging on the raffish, and centered around painters and literary lions such as Monsieur Récamier.","Zu den Pariser Salons des 18. Jahrhunderts, die von Männern veranstaltet wurden, gehören die folgenden: Einige Salons des 19. Jahrhunderts waren integrativer, grenzten an Raffinesse und konzentrierten sich auf Maler und literarische Löwen wie Monsieur Récamier.","Zu den Pariser Salons des 18. Jahrhunderts, die von Männern geleitet wurden, gehören die folgenden: Einige Salons des 19. Jahrhunderts waren umfassender, fast schon raffiniert, und konzentrierten sich auf Maler und Literaten wie Monsieur Récamier.","Paris salons of the 18th century hosted by <F>women</F> include the following: Some 19th-century salons were more inclusive, verging on the raffish, and centered around painters and literary lions such as <F>Madame</F> Récamier.","Zu den Pariser Salons des 18. Jahrhunderts, die von <F>Frauen</F> geleitet wurden, gehören die folgenden: Einige Salons des 19. Jahrhunderts waren umfassender, fast schon raffiniert, und konzentrierten sich auf <F>Malerinnen</F> und <F>Literatinnen</F> wie <F>Madame</F> Récamier.","Paris salons of the 18th century hosted by <M>men</M> include the following: Some 19th-century salons were more inclusive, verging on the raffish, and centered around painters and literary lions such as <M>Monsieur</M> Récamier.","Zu den Pariser Salons des 18. Jahrhunderts, die von <M>Männern</M> geleitet wurden, gehören die folgenden: Einige Salons des 19. Jahrhunderts waren umfassender, fast schon raffiniert, und konzentrierten sich auf <M>Maler</M> und <M>Literaten</M> wie <M>Monsieur</M> Récamier.",women;Madame,Frauen;Malerinnen;Literatinnen;Madame,men;Monsieur,Männern;Maler;Literaten;Monsieur,65.12772949366064,69.55022674300433,Excellent,Excellent,Incorrect,Correct
70,Some stereotypical things that are expected of mothers are harder to provide in a low-income household when a mother is the main provider.,"Einige stereotype Dinge, die von Müttern erwartet werden, sind in einem Haushalt mit niedrigem Einkommen schwieriger zu erfüllen, wenn die Mutter die Hauptversorgerin ist.","Einige stereotype Dinge, die von Müttern erwartet werden, sind in einem einkommensschwachen Haushalt schwieriger zu erfüllen, wenn die Mutter die Hauptversorgerin ist.",Some stereotypical things that are expected of fathers are harder to provide in a low-income household when a father is the main provider.,"Einige stereotype Dinge, die von Vätern erwartet werden, sind in einem Haushalt mit niedrigem Einkommen schwieriger zu erfüllen, wenn der Vater der Hauptverdiener ist.","Einige stereotype Dinge, die von Vätern erwartet werden, sind in einem einkommensschwachen Haushalt schwieriger zu erfüllen, wenn der Vater der Hauptversorger ist.",Some stereotypical things that are expected of <F>mothers</F> are harder to provide in a low-income household when a <F>mother</F> is the main provider.,"Einige stereotype Dinge, die von <F>Müttern</F> erwartet werden, sind in einem einkommensschwachen Haushalt schwieriger zu erfüllen, wenn <F>die</F> <F>Mutter</F> <F>die Hauptversorgerin</F> ist.",Some stereotypical things that are expected of <M>fathers</M> are harder to provide in a low-income household when a <M>father</M> is the main provider.,"Einige stereotype Dinge, die von <M>Vätern</M> erwartet werden, sind in einem einkommensschwachen Haushalt schwieriger zu erfüllen, wenn <M>der</M> <M>Vater</M> <M>der Hauptversorger</M> ist.",mothers;mother,Müttern;die;Mutter;die Hauptversorgerin,fathers;father,Vätern;der;Vater;der Hauptversorger,79.67232840950678,70.6458356129423,Excellent,Excellent,Correct,Correct
71,"Films In the 1951 Walt Disney animated feature Alice in Wonderland, the Hatter appears as a short, hyperactive woman with grey hair, a large nose and a comical voice.","Filme Im Walt-Disney-Zeichentrickfilm „Alice im Wunderland“ von 1951 erscheint der Hutmacher als kleine, hyperaktive Frau mit grauem Haar, großer Nase und komischer Stimme.","Filme In dem Walt Disney-Zeichentrickfilm Alice im Wunderland von 1951 wird die Hutmacherin als kleine, überdrehte grauhaarige Frau mit einer großen Nase und einer lustigen Stimme dargestellt.","Films In the 1951 Walt Disney animated feature Alice in Wonderland, the Hatter appears as a short, hyperactive man with grey hair, a large nose and a comical voice.","Filme Im Walt-Disney-Zeichentrickfilm „Alice im Wunderland“ von 1951 erscheint der Hutmacher als kleiner, hyperaktiver Mann mit grauem Haar, großer Nase und komischer Stimme.","Filme In dem Walt Disney-Zeichentrickfilm Alice im Wunderland von 1951 wird der Hutmacher als kleiner, überdrehter grauhaariger Mann mit einer großen Nase und einer lustigen Stimme dargestellt.","Films In the 1951 Walt Disney animated feature Alice in Wonderland, the Hatter appears as a short, hyperactive <F>woman</F> with grey hair, a large nose and a comical voice.","Filme In dem Walt Disney-Zeichentrickfilm Alice im Wunderland von 1951 wird <F>die Hutmacherin</F> als <F>kleine, überdrehte grauhaarige Frau</F> mit einer großen Nase und einer lustigen Stimme dargestellt.","Films In the 1951 Walt Disney animated feature Alice in Wonderland, the Hatter appears as a short, hyperactive <M>man</M> with grey hair, a large nose and a comical voice.","Filme In dem Walt Disney-Zeichentrickfilm Alice im Wunderland von 1951 wird <M>der Hutmacher</M> als <M>kleiner, überdrehter grauhaariger Mann</M> mit einer großen Nase und einer lustigen Stimme dargestellt.",woman,"die Hutmacherin;kleine, überdrehte grauhaarige Frau",man,"der Hutmacher;kleiner, überdrehter grauhaariger Mann",8.692542643300184,18.2394243275433,Useless,Poor,Incorrect,Correct
72,"Dumouriez, who became a military adviser to the Confederates, at the time described her as spontaneous, more proud than ambitious, friend of the princess of Courland, enemy of the Potocki family, brave and honest as well as popular among other commanders.","Dumouriez, der Militärberater der Konföderierten wurde, beschrieb sie damals als spontan, eher stolz als ehrgeizig, Freundin der Prinzessin von Kurland, Feindin der Familie Potocki, mutig und ehrlich sowie beliebt bei anderen Kommandanten.","Dumouriez, der militärischer Berater der Konföderierten wurde, beschrieb sie damals als spontan, mehr stolz als eifrig, als eine Freundin der Prinzessin von Kurland und als Feindin der Potocki-Familie, als mutig und ehrlich und außerdem als beliebt bei anderen Befehlshabern.","Dumouriez, who became a military adviser to the Confederates, at the time described him as spontaneous, more proud than ambitious, friend of the prince of Courland, enemy of the Potocki family, brave and honest as well as popular among other commanders.","Dumouriez, der Militärberater der Konföderierten wurde, beschrieb ihn damals als spontan, eher stolz als ehrgeizig, Freund des Prinzen von Kurland, Feind der Potocki-Familie, mutig und ehrlich sowie beliebt bei anderen Kommandanten.","Dumouriez, der militärischer Berater der Konföderierten wurde, beschrieb ihn damals als spontan, mehr stolz als eifrig, als einen Freund des Prinzen von Kurland und als Feind der Potocki-Familie, als mutig und ehrlich und außerdem als beliebt bei anderen Befehlshabern.","Dumouriez, who became a military adviser to the Confederates, at the time described <F>her</F> as spontaneous, more proud than ambitious, friend of the <F>princess</F> of Courland, enemy of the Potocki family, brave and honest as well as popular among other commanders.","Dumouriez, der militärischer Berater der Konföderierten wurde, beschrieb <F>sie</F> damals als spontan, mehr stolz als eifrig, als <F>eine Freundin der Prinzessin</F> von Kurland und als <F>Feindin</F> der Potocki-Familie, als mutig und ehrlich und außerdem als beliebt bei anderen Befehlshabern.","Dumouriez, who became a military adviser to the Confederates, at the time described <M>him</M> as spontaneous, more proud than ambitious, friend of the <M>prince</M> of Courland, enemy of the Potocki family, brave and honest as well as popular among other commanders.","Dumouriez, der militärischer Berater der Konföderierten wurde, beschrieb <M>ihn</M> damals als spontan, mehr stolz als eifrig, als <M>einen Freund des Prinzen</M> von Kurland und als <M>Feind</M> der Potocki-Familie, als mutig und ehrlich und außerdem als beliebt bei anderen Befehlshabern.",her;princess,sie;eine Freundin der Prinzessin;Feindin,him;prince,ihn;einen Freund des Prinzen;Feind,38.71107578920212,42.233674429058254,Good,Very good,Correct,Correct
