orig_id,source_feminine,translate_feminine,reference_feminine,source_masculine,translate_masculine,reference_masculine,source_feminine_annotated,reference_feminine_annotated,source_masculine_annotated,reference_masculine_annotated,source_feminine_keywords,reference_feminine_keywords,source_masculine_keywords,reference_masculine_keywords,scores_f_bleu,scores_m_bleu,f_quality_bins,m_quality_bins,decision_f,decision_m
61,"The home was supposed to be a refuge from the dangers of the outside world, but in the novel, the seemingly perfect domestic lady turns out to be a violent criminal who has not only tried to commit murder but who has also committed bigamy and abandoned her child.","La casa avrebbe dovuto essere un rifugio dai pericoli del mondo esterno, ma nel romanzo, la domestica apparentemente perfetta si rivela essere una criminale violenta che non solo ha tentato di commettere un omicidio ma che ha anche commesso bigamia e l'ha abbandonata. bambino.","La casa doveva rappresentare un rifugio dai pericoli del mondo esterno, ma nel romanzo, l'apparentemente perfetta donna di casa si rivela essere una violenta criminale che non ha solo cercato di commettere un omicidio, ma era anche bigama e aveva abbandonato suo figlio.","The home was supposed to be a refuge from the dangers of the outside world, but in the novel, the seemingly perfect domestic gentleman turns out to be a violent criminal who has not only tried to commit murder but who has also committed bigamy and abandoned his child.","La casa doveva essere un rifugio dai pericoli del mondo esterno, ma nel romanzo l'apparentemente perfetto gentiluomo domestico si rivela un criminale violento che non solo ha tentato di commettere un omicidio, ma ha anche commesso bigamia e ha abbandonato la sua vita. bambino.","La casa doveva rappresentare un rifugio dai pericoli del mondo esterno, ma nel romanzo, l'apparentemente perfetto uomo di casa si rivela essere un violento criminale che non ha solo cercato di commettere un omicidio, ma era anche bigamo e aveva abbandonato suo figlio.","The home was supposed to be a refuge from the dangers of the outside world, but in the novel, the seemingly perfect domestic <F>lady</F> turns out to be a violent criminal who has not only tried to commit murder but who has also committed bigamy and abandoned <F>her</F> child.","La casa doveva rappresentare un rifugio dai pericoli del mondo esterno, ma nel romanzo, l'apparentemente <F>perfetta donna</F> di casa si rivela essere <F>una violenta</F> criminale che non ha solo cercato di commettere un omicidio, ma era anche <F>bigama</F> e aveva abbandonato suo figlio.","The home was supposed to be a refuge from the dangers of the outside world, but in the novel, the seemingly perfect domestic <M>gentleman</M> turns out to be a violent criminal who has not only tried to commit murder but who has also committed bigamy and abandoned <M>his</M> child.","La casa doveva rappresentare un rifugio dai pericoli del mondo esterno, ma nel romanzo, l'apparentemente <M>perfetto uomo</M> di casa si rivela essere <M>un violento</M> criminale che non ha solo cercato di commettere un omicidio, ma era anche <M>bigamo</M> e aveva abbandonato suo figlio.",lady;her,perfetta donna;una violenta;bigama,gentleman;his,perfetto uomo;un violento;bigamo,37.92012019307453,39.73591965833931,Good,Good,Correct,Correct
62,"She thinks Machiavelli may have been influenced by Tacitus as well as her own experience, but finds no clear predecessor to substantiate this claim.","Pensa che Machiavelli possa essere stato influenzato da Tacito così come dalla sua stessa esperienza, ma non trova alcun chiaro predecessore a sostegno di questa affermazione.","Pensa che Machiavelli possa essere stata influenzata da Tacito e dalla sua esperienza personale, ma non trova nessun chiaro predecessore che giustifichi questa sua affermazione.","He thinks Machiavelli may have been influenced by Tacitus as well as his own experience, but finds no clear predecessor to substantiate this claim.","Pensa che Machiavelli possa essere stato influenzato da Tacito così come dalla sua stessa esperienza, ma non trova alcun chiaro predecessore a sostegno di questa affermazione.","Pensa che Machiavelli possa essere stato influenzato da Tacito e dalla sua esperienza personale, ma non trova nessun chiaro predecessore che giustifichi questa sua affermazione.","<F>She</F> thinks Machiavelli may have been influenced by Tacitus as well as <F>her</F> own experience, but finds no clear predecessor to substantiate this claim.","Pensa che Machiavelli possa essere <F>stata influenzata</F> da Tacito e dalla sua esperienza personale, ma non trova nessun chiaro predecessore che giustifichi questa sua affermazione.","<M>He</M> thinks Machiavelli may have been influenced by Tacitus as well as <M>his</M> own experience, but finds no clear predecessor to substantiate this claim.","Pensa che Machiavelli possa essere <M>stato influenzato</M> da Tacito e dalla sua esperienza personale, ma non trova nessun chiaro predecessore che giustifichi questa sua affermazione.",She;her,stata influenzata,He;his,stato influenzato,28.26185072975154,44.06189608707621,Fair,Very good,Incorrect,Correct
63,"Her election was a first in many ways: She became the first woman elected (rather than appointed) an AFL-CIO officer, the first person of color of either sex elected an AFL-CIO officer, and the first Hispanic elected an AFL-CIO officer.","La sua elezione è stata la prima in molti modi: è diventata la prima donna eletta (piuttosto che nominata) ufficiale dell'AFL-CIO, la prima persona di colore di entrambi i sessi eletta ufficiale dell'AFL-CIO e la prima ispanica eletta ufficiale dell'AFL-CIO ufficiale.","La sua elezione ha segnato una prima volta sotto molti punti di vista: è diventata la prima donna eletta (anziché nominata) come funzionario AFL-CIO, nonché la prima persona di colore e la prima ispanica a ricoprire questa carica.","His election was a first in many ways: He became the first man elected (rather than appointed) an AFL-CIO officer, the first person of color of either sex elected an AFL-CIO officer, and the first Hispanic elected an AFL-CIO officer.","La sua elezione è stata la prima in molti modi: è diventato il primo uomo eletto (piuttosto che nominato) ufficiale dell'AFL-CIO, la prima persona di colore di entrambi i sessi eletta ufficiale dell'AFL-CIO e il primo ispanico eletto ufficiale dell'AFL-CIO ufficiale.","La sua elezione ha segnato una prima volta sotto molti punti di vista: è diventato il primo uomo eletto (anziché nominato) come funzionario AFL-CIO, nonché la prima persona di colore e il primo ispanico a ricoprire questa carica.","<F>Her</F> election was a first in many ways: <F>She</F> became the first <F>woman</F> elected (rather than appointed) an AFL-CIO officer, the first person of color of either sex elected an AFL-CIO officer, and the first Hispanic elected an AFL-CIO officer.","La sua elezione ha segnato una prima volta sotto molti punti di vista: è <F>diventata la prima donna eletta</F> (anziché <F>nominata</F>) come funzionario AFL-CIO, nonché la prima persona di colore e <F>la prima ispanica</F> a ricoprire questa carica.","<M>His</M> election was a first in many ways: <M>He</M> became the first <M>man</M> elected (rather than appointed) an AFL-CIO officer, the first person of color of either sex elected an AFL-CIO officer, and the first Hispanic elected an AFL-CIO officer.","La sua elezione ha segnato una prima volta sotto molti punti di vista: è <M>diventato il primo uomo eletto</M> (anziché <M>nominato</M>) come funzionario AFL-CIO, nonché la prima persona di colore e <M>il primo ispanico</M> a ricoprire questa carica.",Her;She;woman,diventata la prima donna eletta;nominata;la prima ispanica,His;He;man,diventato il primo uomo eletto;nominato;il primo ispanico,32.56852650511272,32.56852650511272,Good,Good,Correct,Incorrect
64,Kellner too well knew how to flatter the baroness's inordinate vanity: the author of the Holy Alliance could be none other than the woman clothed with the sun from the Book of Revelation.,Anche Kellner sapeva lusingare la smodata vanità della baronessa: l'autrice della Santa Alleanza non poteva essere altro che la donna vestita di sole dell'Apocalisse.,Kellner sapeva fin troppo bene come lusingare la smisurata vanità della baronessa: a promuovere la Sacra Alleanza non poteva che essere la donna vestita di sole descritta nel libro dell'Apocalisse.,Kellner too well knew how to flatter the baron's inordinate vanity: the author of the Holy Alliance could be none other than the man clothed with the sun from the Book of Revelation.,Anche Kellner sapeva bene lusingare la smodata vanità del barone: l'autore della Santa Alleanza non poteva essere altri che l'uomo vestito di sole dell'Apocalisse.,Kellner sapeva fin troppo bene come lusingare la smisurata vanità del barone: a promuovere la Sacra Alleanza non poteva che essere l'uomo vestito di sole descritto nel libro dell'Apocalisse.,Kellner too well knew how to flatter the <F>baroness's</F> inordinate vanity: the author of the Holy Alliance could be none other than the <F>woman</F> clothed with the sun from the Book of Revelation.,Kellner sapeva fin troppo bene come lusingare la smisurata vanità <F>della baronessa</F>: a promuovere la Sacra Alleanza non poteva che essere <F>la donna vestita</F> di sole <F>descritta</F> nel libro dell'Apocalisse.,Kellner too well knew how to flatter the <M>baron's</M> inordinate vanity: the author of the Holy Alliance could be none other than the <M>man</M> clothed with the sun from the Book of Revelation.,Kellner sapeva fin troppo bene come lusingare la smisurata vanità <M>del barone</M>: a promuovere la Sacra Alleanza non poteva che essere <M>l'uomo vestito</M> di sole <M>descritto</M> nel libro dell'Apocalisse.,baroness's;woman,della baronessa;la donna vestita;descritta,baron's;man,del barone;l'uomo vestito;descritto,26.298805587716423,23.087366224485123,Fair,Fair,Correct,Incorrect
65,In June 2015 she became Chair of the Council of businesswomen of Almaty National Chamber of Entrepreneurs «Atameken».,Nel giugno 2015 è diventata presidente del Consiglio delle imprenditrici della Camera nazionale degli imprenditori di Almaty «Atameken».,Nel giugno del 2015 divenne presidentessa del consiglio delle imprenditrici della Almaty National Chamber of Entrepreneurs (Atameken).,In June 2015 he became Chair of the Council of businessmen of Almaty National Chamber of Entrepreneurs «Atameken».,Nel giugno 2015 è diventato presidente del Consiglio degli imprenditori della Camera nazionale degli imprenditori di Almaty «Atameken».,Nel giugno del 2015 divenne presidente del consiglio degli imprenditori della Almaty National Chamber of Entrepreneurs (Atameken).,In June 2015 <F>she</F> became Chair of the Council of <F>businesswomen</F> of Almaty National Chamber of Entrepreneurs «Atameken».,Nel giugno del 2015 divenne <F>presidentessa</F> del consiglio <F>delle imprenditrici</F> della Almaty National Chamber of Entrepreneurs (Atameken).,In June 2015 <M>he</M> became Chair of the Council of <M>businessmen</M> of Almaty National Chamber of Entrepreneurs «Atameken».,Nel giugno del 2015 divenne <M>presidente</M> del consiglio <M>degli imprenditori</M> della Almaty National Chamber of Entrepreneurs (Atameken).,she;businesswomen,presidentessa;delle imprenditrici,he;businessmen,presidente;degli imprenditori,10.413029177416922,11.488177632088458,Poor,Poor,Incorrect,Correct
66,"Separately, by 2002 she was serving as honorary chairwomen of the German-Portuguese parliamentary group.","Separatamente, nel 2002 era presidentessa onoraria del gruppo parlamentare tedesco-portoghese.","Inoltre, nel 2002 divenne presidentessa onoraria del gruppo parlamentare Tedesco-Portoghese.","Separately, by 2002 he was serving as honorary chairmen of the German-Portuguese parliamentary group.","Separatamente, nel 2002 è stato presidente onorario del gruppo parlamentare tedesco-portoghese.","Inoltre, nel 2002 divenne presidente onorario del gruppo parlamentare Tedesco-Portoghese.","Separately, by 2002 <F>she</F> was serving as honorary <F>chairwomen</F> of the German-Portuguese parliamentary group.","Inoltre, nel 2002 divenne <F>presidentessa onoraria</F> del gruppo parlamentare Tedesco-Portoghese.","Separately, by 2002 <M>he</M> was serving as honorary <M>chairmen</M> of the German-Portuguese parliamentary group.","Inoltre, nel 2002 divenne <M>presidente onorario</M> del gruppo parlamentare Tedesco-Portoghese.",she;chairwomen,presidentessa onoraria,he;chairmen,presidente onorario,43.66835442847811,39.832871551569504,Very good,Good,Correct,Correct
67,"She became chairwoman and chief spokeswoman for Greenpeace in 1979, retiring in 1991 to live on an olive farm in Paciano, Umbria, Italy.","Divenne presidente e portavoce principale di Greenpeace nel 1979, ritirandosi nel 1991 per vivere in una fattoria olivicola a Paciano, Umbria, Italia.","Lei divenne presidentessa e portavoce di Greenpeace nel 1979, andò in pensione nel 1991 e visse in una fattoria di olivi a Paciano, Umbria in Italia.","He became chairman and chief spokesman for Greenpeace in 1979, retiring in 1991 to live on an olive farm in Paciano, Umbria, Italy.","Divenne presidente e portavoce principale di Greenpeace nel 1979, ritirandosi nel 1991 per vivere in una fattoria olivicola a Paciano, Umbria, Italia.","Lui divenne presidente e portavoce di Greenpeace nel 1979, andò in pensione nel 1991 e visse in una fattoria di olivi a Paciano, Umbria in Italia.","<F>She</F> became <F>chairwoman</F> and chief <F>spokeswoman</F> for Greenpeace in 1979, retiring in 1991 to live on an olive farm in Paciano, Umbria, Italy.","<F>Lei</F> divenne <F>presidentessa</F> e portavoce di Greenpeace nel 1979, andò in pensione nel 1991 e visse in una fattoria di olivi a Paciano, Umbria in Italia.","<M>He</M> became <M>chairman</M> and chief <M>spokesman</M> for Greenpeace in 1979, retiring in 1991 to live on an olive farm in Paciano, Umbria, Italy.","<M>Lui</M> divenne <M>presidente</M> e portavoce di Greenpeace nel 1979, andò in pensione nel 1991 e visse in una fattoria di olivi a Paciano, Umbria in Italia.",She;chairwoman;spokeswoman,Lei;presidentessa,He;chairman;spokesman,Lui;presidente,28.747994540774503,30.896198853891388,Fair,Good,Incorrect,Correct
68,"She was named governor of Volterra in 1696, where she strenuously exerted herself to improve public morality.","Fu nominata governatrice di Volterra nel 1696, dove si impegnò strenuamente per migliorare la moralità pubblica.","Nel 1696 fu nominata governatrice di Volterra, dove si impegnò strenuamente a migliorare la moralità pubblica.","He was named governor of Volterra in 1696, where he strenuously exerted himself to improve public morality.","Fu nominato governatore di Volterra nel 1696, dove si impegnò strenuamente per migliorare la moralità pubblica.","Nel 1696 fu nominato governatore di Volterra, dove si impegnò strenuamente a migliorare la moralità pubblica.","<F>She</F> was named governor of Volterra in 1696, where <F>she</F> strenuously exerted <F>herself</F> to improve public morality.","Nel 1696 fu <F>nominata governatrice</F> di Volterra, dove si impegnò strenuamente a migliorare la moralità pubblica.","<M>He</M> was named governor of Volterra in 1696, where <M>he</M> strenuously exerted <M>himself</M> to improve public morality.","Nel 1696 fu <M>nominato governatore</M> di Volterra, dove si impegnò strenuamente a migliorare la moralità pubblica.",She;she;herself,nominata governatrice,He;he;himself,nominato governatore,54.75235665340891,54.75235665340891,Excellent,Excellent,Correct,Correct
69,"The peerages were inherited by the late Baroness's first cousin, the seventh Baroness.","I titoli nobiliari furono ereditati dalla cugina di primo grado della defunta Baronessa, la settima Baronessa.","I titoli sono stati ereditati dalla cugina di primo grado della defunta baronessa, la settima baronessa.","The peerages were inherited by the late Baron's first cousin, the seventh Baron.","I titoli nobiliari furono ereditati dal cugino di primo grado del defunto barone, il settimo barone.","I titoli sono stati ereditati dal cugino di primo grado del defunto barone, il settimo barone.","The peerages were inherited by the late <F>Baroness's</F> first cousin, the seventh <F>Baroness</F>.","I titoli sono stati ereditati <F>dalla cugina</F> di primo grado <F>della defunta baronessa, la settima baronessa</F>.","The peerages were inherited by the late <M>Baron's</M> first cousin, the seventh <M>Baron</M>.","I titoli sono stati ereditati <M>dal cugino</M> di primo grado <M>del defunto barone, il settimo barone</M>.",Baroness's;Baroness,"dalla cugina;della defunta baronessa, la settima baronessa",Baron's;Baron,"dal cugino;del defunto barone, il settimo barone",50.82365016563264,79.65670178751185,Excellent,Excellent,Correct,Correct
70,"She began as a mechanic, then became a driver, created her own team and then became chairwoman of Vaillante.","Ha iniziato come meccanico, poi è diventata pilota, ha creato una propria scuderia e poi è diventata presidente della Vaillante.","Ha iniziato come meccanica, poi è diventata pilota, ha creato la sua squadra e poi è diventata presidentessa della Vaillante.","He began as a mechanic, then became a driver, created his own team and then became chairman of Vaillante.","Ha iniziato come meccanico, poi è diventato pilota, ha creato una propria scuderia e poi è diventato presidente della Vaillante.","Ha iniziato come meccanico, poi è diventato pilota, ha creato la sua squadra e poi è diventato presidente della Vaillante.","<F>She</F> began as a mechanic, then became a driver, created <F>her</F> own team and then became <F>chairwoman</F> of Vaillante.","Ha iniziato come <F>meccanica</F>, poi è <F>diventata</F> pilota, ha creato la sua squadra e poi è <F>diventata presidentessa</F> della Vaillante.","<M>He</M> began as a mechanic, then became a driver, created <M>his</M> own team and then became <M>chairman</M> of Vaillante.","Ha iniziato come <M>meccanico</M>, poi è <M>diventato</M> pilota, ha creato la sua squadra e poi è <M>diventato presidente</M> della Vaillante.",She;her;chairwoman,meccanica;diventata;diventata presidentessa,He;his;chairman,meccanico;diventato;diventato presidente,51.64615519906901,78.4851834939063,Excellent,Excellent,Incorrect,Correct
71,"Her mother also held the title of a landgrave of Brabant, duchess of Lower Lorraine and margrave of Antwerp.","Sua madre aveva anche il titolo di langravio del Brabante, duchessa della Bassa Lorena e margravio di Anversa.","Sua madre inoltre deteneva i titoli di langravina del Brabante, duchessa della Bassa Lorena e margravia di Anversa.","His father also held the title of a landgrave of Brabant, duke of Lower Lorraine and margrave of Antwerp.","Suo padre possedeva anche il titolo di langravio del Brabante, duca della Bassa Lorena e margravio di Anversa.","Suo padre inoltre deteneva i titoli di langravio del Brabante, duca della Bassa Lorena e margravio di Anversa.","<F>Her</F> <F>mother</F> also held the title of a landgrave of Brabant, <F>duchess</F> of Lower Lorraine and margrave of Antwerp.","<F>Sua madre</F> inoltre deteneva i titoli di <F>langravina</F> del Brabante, <F>duchessa</F> della Bassa Lorena e <F>margravia</F> di Anversa.","<M>His</M> <M>father</M> also held the title of a landgrave of Brabant, <M>duke</M> of Lower Lorraine and margrave of Antwerp.","<M>Suo padre</M> inoltre deteneva i titoli di <M>langravio</M> del Brabante, <M>duca</M> della Bassa Lorena e <M>margravio</M> di Anversa.",Her;mother;duchess,Sua madre;langravina;duchessa;margravia,His;father;duke,Suo padre;langravio;duca;margravio,45.30777803692813,71.01158913184165,Very good,Excellent,Incorrect,Correct
72,"In particular, she did not bear children, despite twelve years of marriage, and this is perhaps emphasised in her epitaph, whereby she is mentioned as having been kind to pregnant women.","In particolare non ebbe figli, nonostante dodici anni di matrimonio, e questo è forse sottolineato nel suo epitaffio, in cui viene menzionata come gentile con le donne incinte.","""In particolare, non ha partorito alcun figlio in dodici anni di matrimonio, e questo è probabilmente enfatizzato nel suo epitaffio, dove viene descritta come """"gentile nei confronti delle donne incinte"""".""","In particular, he did not bear children, despite twelve years of marriage, and this is perhaps emphasised in his epitaph, whereby he is mentioned as having been kind to pregnant men.","In particolare non ebbe figli, nonostante dodici anni di matrimonio, e questo è forse sottolineato nel suo epitaffio, in cui viene menzionato come gentile con le donne incinte.","""In particolare, non ha partorito alcun figlio in dodici anni di matrimonio, e questo è probabilmente enfatizzato nel suo epitaffio, dove viene descritto come """"gentile nei confronti degli uomini incinti"""".""","In particular, <F>she</F> did not bear children, despite twelve years of marriage, and this is perhaps emphasised in <F>her</F> epitaph, whereby <F>she</F> is mentioned as having been kind to pregnant <F>women</F>.","In particolare, non ha partorito alcun figlio in dodici anni di matrimonio, e questo è probabilmente enfatizzato nel suo epitaffio, dove viene <F>descritta</F> come ""gentile nei confronti <F>delle donne incinte</F>"".","In particular, <M>he</M> did not bear children, despite twelve years of marriage, and this is perhaps emphasised in <M>his</M> epitaph, whereby <M>he</M> is mentioned as having been kind to pregnant <M>men</M>.","In particolare, non ha partorito alcun figlio in dodici anni di matrimonio, e questo è probabilmente enfatizzato nel suo epitaffio, dove viene <M>descritto</M> come ""gentile nei confronti <M>degli uomini incinti</M>"".",she;her;she;women,descritta;delle donne incinte,he;his;he;men,descritto;degli uomini incinti,27.412978672124986,26.219955643049524,Fair,Fair,Correct,Incorrect
73,"In 1947 (to 1950), she became first chairwoman of a standing committee of the Bar Association of the City of New York.","Nel 1947 (fino al 1950), divenne la prima presidente di un comitato permanente dell'Ordine degli avvocati della città di New York.","Nel 1947, divenne la prima presidentessa di una commissione permanente della Bar Association della città di New York, carica che ricoprì fino al 1950.","In 1947 (to 1950), he became first chairman of a standing committee of the Bar Association of the City of New York.","Nel 1947 (fino al 1950), divenne il primo presidente di un comitato permanente dell'Ordine degli avvocati della città di New York.","Nel 1947, divenne il primo presidente di una commissione permanente della Bar Association della città di New York, carica che ricoprì fino al 1950.","In 1947 (to 1950), <F>she</F> became first <F>chairwoman</F> of a standing committee of the Bar Association of the City of New York.","Nel 1947, divenne <F>la prima presidentessa</F> di una commissione permanente della Bar Association della città di New York, carica che ricoprì fino al 1950.","In 1947 (to 1950), <M>he</M> became first <M>chairman</M> of a standing committee of the Bar Association of the City of New York.","Nel 1947, divenne <M>il primo presidente</M> di una commissione permanente della Bar Association della città di New York, carica che ricoprì fino al 1950.",she;chairwoman,la prima presidentessa,he;chairman,il primo presidente,29.2490224790217,37.91485812835688,Fair,Good,Incorrect,Correct
74,"Both there and at Pisa, where she was subsequently governor in 1700, her popularity was so great that on her removal the inhabitants of both cities petitioned for her recall.","Sia lì che a Pisa, dove fu poi governatrice nel 1700, la sua popolarità fu tale che alla sua destituzione gli abitanti di entrambe le città ne chiesero la revoca.","Sia lì che a Pisa, dove fu poi governatrice nel 1700, era talmente popolare che dopo la sua rimozione gli abitanti di entrambe le città firmarono una petizione per riaverla.","Both there and at Pisa, where he was subsequently governor in 1700, his popularity was so great that on his removal the inhabitants of both cities petitioned for his recall.","Sia lì che a Pisa, dove fu successivamente governatore nel 1700, la sua popolarità fu tale che alla sua destituzione gli abitanti di entrambe le città ne chiesero la revoca.","Sia lì che a Pisa, dove fu poi governatore nel 1700, era talmente popolare che dopo la sua rimozione gli abitanti di entrambe le città firmarono una petizione per riaverlo.","Both there and at Pisa, where <F>she</F> was subsequently governor in 1700, <F>her</F> popularity was so great that on <F>her</F> removal the inhabitants of both cities petitioned for <F>her</F> recall.","Sia lì che a Pisa, dove fu poi <F>governatrice</F> nel 1700, era talmente popolare che dopo la sua rimozione gli abitanti di entrambe le città firmarono una petizione per <F>riaverla</F>.","Both there and at Pisa, where <M>he</M> was subsequently governor in 1700, <M>his</M> popularity was so great that on <M>his</M> removal the inhabitants of both cities petitioned for <M>his</M> recall.","Sia lì che a Pisa, dove fu poi <M>governatore</M> nel 1700, era talmente popolare che dopo la sua rimozione gli abitanti di entrambe le città firmarono una petizione per <M>riaverlo</M>.",she;her;her;her,governatrice;riaverla,he;his;his;his,governatore;riaverlo,53.54538202508016,44.356256687775854,Excellent,Very good,Correct,Correct
