orig_id,source_feminine,translate_feminine,reference_feminine,source_masculine,translate_masculine,reference_masculine,source_feminine_annotated,reference_feminine_annotated,source_masculine_annotated,reference_masculine_annotated,source_feminine_keywords,reference_feminine_keywords,source_masculine_keywords,reference_masculine_keywords,scores_f_bleu,scores_m_bleu,f_quality_bins,m_quality_bins,decision_f,decision_m
208,"Kertész is a member of the Movimento Mulher 360, an organization for Brazilian businesswomen that aims to expand female participation in business.","Kertész è membro del Movimento Mulher 360, un'organizzazione per donne imprenditrici brasiliane che mira ad espandere la partecipazione femminile negli affari.","Kertész è un membro del Movimento Donne 360, un'organizzazione per imprenditrici brasiliane che punta ad espandere la partecipazione femminile nel settore.","Kertész is a member of the Movimento Homem 360, an organization for Brazilian businessmen that aims to expand male participation in business.","Kertész è membro del Movimento Homem 360, un'organizzazione per uomini d'affari brasiliani che mira ad espandere la partecipazione maschile negli affari.","Kertész è un membro del Movimento Uomini 360, un'organizzazione per imprenditrori brasiliani che punta ad espandere la partecipazione maschile nel settore.","Kertész is a member of the Movimento <F>Mulher</F> 360, an organization for Brazilian <F>businesswomen</F> that aims to expand <F>female</F> participation in business.","Kertész è un membro del Movimento <F>Donne</F> 360, un'organizzazione per <F>imprenditrici brasiliane</F> che punta ad espandere la partecipazione <F>femminile</F> nel settore.","Kertész is a member of the Movimento <M>Homem</M> 360, an organization for Brazilian <M>businessmen</M> that aims to expand <M>male</M> participation in business.","Kertész è un membro del Movimento <M>Uomini</M> 360, un'organizzazione per <M>imprenditrori brasiliani</M> che punta ad espandere la partecipazione <M>maschile</M> nel settore.",Mulher;businesswomen;female,Donne;imprenditrici brasiliane;femminile,Homem;businessmen;male,Uomini;imprenditrori brasiliani;maschile,38.22243138097081,35.47550415613527,Good,Good,Correct,Correct
209,"The Guardian commented that the fact that the range of T-shirts she has recently designed for TopShop – emblazoned with slogans like Breaking Up With Her Boyfriend – are flying out, speaks volumes for her public support.","Il Guardian ha commentato che il fatto che la gamma di magliette che ha recentemente disegnato per TopShop – decorate con slogan come Breaking Up With Her Boyfriend – stia volando via, la dice lunga sul suo sostegno pubblico.","""Il Guardian ha commentato che la grande popolarità delle magliette che ha recentemente disegnato per TopShop - che riportano slogan come """"Breaking Up With Her Boyfriend"""" - la dice lunga su quanto il pubblico la ami.""","The Guardian commented that the fact that the range of T-shirts he has recently designed for TopShop – emblazoned with slogans like Breaking Up With Her Boyfriend – are flying out, speaks volumes for his public support.","Il Guardian ha commentato che il fatto che la gamma di magliette che ha recentemente disegnato per TopShop – decorate con slogan come Breaking Up With Her Boyfriend – stia volando via, la dice lunga sul suo sostegno pubblico.","""Il Guardian ha commentato che la grande popolarità delle magliette che ha recentemente disegnato per TopShop - che riportano slogan come """"Breaking Up With Her Boyfriend"""" - la dice lunga su quanto il pubblico lo ami.""","The Guardian commented that the fact that the range of T-shirts <F>she</F> has recently designed for TopShop – emblazoned with slogans like Breaking Up With Her Boyfriend – are flying out, speaks volumes for <F>her</F> public support.","Il Guardian ha commentato che la grande popolarità delle magliette che ha recentemente disegnato per TopShop - che riportano slogan come ""Breaking Up With Her Boyfriend"" - la dice lunga su quanto il pubblico <F>la</F> ami.","The Guardian commented that the fact that the range of T-shirts <M>he</M> has recently designed for TopShop – emblazoned with slogans like Breaking Up With Her Boyfriend – are flying out, speaks volumes for <M>his</M> public support.","Il Guardian ha commentato che la grande popolarità delle magliette che ha recentemente disegnato per TopShop - che riportano slogan come ""Breaking Up With Her Boyfriend"" - la dice lunga su quanto il pubblico <M>lo</M> ami.",she;her,la,he;his,lo,35.45020622667087,35.45020622667087,Good,Good,Correct,Correct
210,"The duchess's duty to attend the Imperial Diet was limited to those cases where it convened within the Bavarian lands (ad curias, quas imperator prefixerit in Bavaria), which saved costly traveling throughout the Empire.","Il dovere della duchessa di partecipare alla Dieta Imperiale era limitato a quei casi in cui si riuniva all'interno delle terre bavaresi (ad curias, quas imperator prefixerit in Baviera), il che risparmiava costosi viaggi in tutto l'Impero.","Il dovere della duchessa di partecipare alla Dieta imperiale era limitato a quando essa si riuniva all'interno delle terre bavaresi (alla corte imperiale in Baviera), il che permetteva di risparmiare viaggi molto dispendiosi in tutto l'Impero.","The duke's duty to attend the Imperial Diet was limited to those cases where it convened within the Bavarian lands (ad curias, quas imperator prefixerit in Bavaria), which saved costly traveling throughout the Empire.","Il dovere del duca di partecipare alla Dieta Imperiale era limitato a quei casi in cui si riuniva all'interno delle terre bavaresi (ad curias, quas imperator prefixerit in Baviera), il che risparmiava costosi viaggi in tutto l'Impero.","Il dovere del duca di partecipare alla Dieta imperiale era limitato a quando essa si riuniva all'interno delle terre bavaresi (alla corte imperiale in Baviera), il che permetteva di risparmiare viaggi molto dispendiosi in tutto l'Impero.","The <F>duchess's</F> duty to attend the Imperial Diet was limited to those cases where it convened within the Bavarian lands (ad curias, quas imperator prefixerit in Bavaria), which saved costly traveling throughout the Empire.","Il dovere <F>della duchessa</F> di partecipare alla Dieta imperiale era limitato a quando essa si riuniva all'interno delle terre bavaresi (alla corte imperiale in Baviera), il che permetteva di risparmiare viaggi molto dispendiosi in tutto l'Impero.","The <M>duke's</M> duty to attend the Imperial Diet was limited to those cases where it convened within the Bavarian lands (ad curias, quas imperator prefixerit in Bavaria), which saved costly traveling throughout the Empire.","Il dovere <M>del duca</M> di partecipare alla Dieta imperiale era limitato a quando essa si riuniva all'interno delle terre bavaresi (alla corte imperiale in Baviera), il che permetteva di risparmiare viaggi molto dispendiosi in tutto l'Impero.",duchess's,della duchessa,duke's,del duca,49.09598600331234,49.09598600331234,Very good,Very good,Correct,Correct
211,"She soon became the leader of the Vaillante society, replacing her mother.","Divenne presto la leader della società Vaillante, in sostituzione della madre.","Lei divenne presto leader della società Vaillante, sostituendo sua madre.","He soon became the leader of the Vaillante society, replacing his father.","Divenne presto il leader della società Vaillante, in sostituzione del padre.","Lui divenne presto leader della società Vaillante, sostituendo suo padre.","<F>She</F> soon became the leader of the Vaillante society, replacing <F>her</F> <F>mother</F>.","<F>Lei</F> divenne presto leader della società Vaillante, sostituendo <F>sua madre</F>.","<M>He</M> soon became the leader of the Vaillante society, replacing <M>his</M> <M>father</M>.","<M>Lui</M> divenne presto leader della società Vaillante, sostituendo <M>suo padre</M>.",She;her;mother,Lei;sua madre,He;his;father,Lui;suo padre,34.38931217657843,34.38931217657843,Good,Good,Correct,Correct
212,"More recently, in 2018, the PBS film The Chaperone was released, which depicts Brooks's initial arrival in New York as well as her career decline as an actress.","Più recentemente, nel 2018, è uscito il film della PBS The Chaperone, che descrive il primo arrivo di Brooks a New York e il declino della sua carriera come attrice.","Più di recente, nel 2018, è uscito il film di PBS The Chaperone - In gita per caso, che racconta l'arrivo di Brooks a New York e il declino della sua carriera da attrice.","More recently, in 2018, the PBS film The Chaperone was released, which depicts Brooks's initial arrival in New York as well as his career decline as an actor.","Più recentemente, nel 2018, è uscito il film della PBS The Chaperone, che descrive il primo arrivo di Brooks a New York e il declino della sua carriera come attore.","Più di recente, nel 2018, è uscito il film di PBS The Chaperone - In gita per caso, che racconta l'arrivo di Brooks a New York e il declino della sua carriera da attore.","More recently, in 2018, the PBS film The Chaperone was released, which depicts Brooks's initial arrival in New York as well as <F>her</F> career decline as an <F>actress</F>.","Più di recente, nel 2018, è uscito il film di PBS The Chaperone - In gita per caso, che racconta l'arrivo di Brooks a New York e il declino della sua carriera da <F>attrice</F>.","More recently, in 2018, the PBS film The Chaperone was released, which depicts Brooks's initial arrival in New York as well as <M>his</M> career decline as an <M>actor</M>.","Più di recente, nel 2018, è uscito il film di PBS The Chaperone - In gita per caso, che racconta l'arrivo di Brooks a New York e il declino della sua carriera da <M>attore</M>.",her;actress,attrice,his;actor,attore,50.72148939189327,50.72148939189327,Excellent,Excellent,Correct,Correct
213,She was particularly concerned by the lack of female teachers to educate Hindu girls.,Era particolarmente preoccupata per la mancanza di insegnanti donne in grado di istruire le ragazze indù.,La scarsità di maestre che potessero seguire le bambine hindu la preoccupava in modo particolare.,He was particularly concerned by the lack of male teachers to educate Hindu boys.,Era particolarmente preoccupato per la mancanza di insegnanti maschi in grado di educare i ragazzi indù.,La scarsità di maestri che potessero seguire i bambini hindu lo preoccupava in modo particolare.,<F>She</F> was particularly concerned by the lack of <F>female</F> teachers to educate Hindu <F>girls</F>.,La scarsità di <F>maestre</F> che potessero seguire <F>le bambine</F> hindu <F>la</F> preoccupava in modo particolare.,<M>He</M> was particularly concerned by the lack of <M>male</M> teachers to educate Hindu <M>boys</M>.,La scarsità di <M>maestri</M> che potessero seguire <M>i bambini</M> hindu <M>lo</M> preoccupava in modo particolare.,She;female;girls,maestre;le bambine;la,He;male;boys,maestri;i bambini;lo,3.4197980307804725,3.234245292096216,Useless,Useless,Correct,Incorrect
214,"She wandered with Kellner from place to place, proclaiming her mission, working miracles, persuading her converts to sell all and follow her.","Vagò con Kellner da un posto all'altro, proclamando la sua missione, operando miracoli, convincendo i suoi convertiti a vendere tutto e seguirla.","Viaggiò con Kellner di luogo in luogo, proclamando la sua missione, facendo miracoli, persuadendo i convertiti a vendere tutto e seguirla.","He wandered with Kellner from place to place, proclaiming his mission, working miracles, persuading his converts to sell all and follow him.","Vagò con Kellner da un posto all'altro, proclamando la sua missione, operando miracoli, persuadendo i suoi convertiti a vendere tutto e seguirlo.","Viaggiò con Kellner di luogo in luogo, proclamando la sua missione, facendo miracoli, persuadendo i convertiti a vendere tutto e seguirlo.","<F>She</F> wandered with Kellner from place to place, proclaiming <F>her</F> mission, working miracles, persuading <F>her</F> converts to sell all and follow <F>her</F>.","Viaggiò con Kellner di luogo in luogo, proclamando la sua missione, facendo miracoli, persuadendo i convertiti a vendere tutto e <F>seguirla</F>.","<M>He</M> wandered with Kellner from place to place, proclaiming <M>his</M> mission, working miracles, persuading <M>his</M> converts to sell all and follow <M>him</M>.","Viaggiò con Kellner di luogo in luogo, proclamando la sua missione, facendo miracoli, persuadendo i convertiti a vendere tutto e <M>seguirlo</M>.",She;her;her;her,seguirla,He;his;his;him,seguirlo,45.022125383821326,51.41842557174701,Very good,Excellent,Correct,Correct
215,"She observed that, Being a nun is good money,...","Ha osservato che, essere una suora è un buon guadagno,...",Osservò che essere una suora portava bei soldi...,"He observed that, Being a monk is good money,...","Ha osservato che, essere un monaco è un buon guadagno, ...",Osservò che essere un monaco portava bei soldi...,"<F>She</F> observed that, Being a <F>nun</F> is good money,...",Osservò che essere <F>una suora</F> portava bei soldi...,"<M>He</M> observed that, Being a <M>monk</M> is good money,...",Osservò che essere <M>un monaco</M> portava bei soldi...,She;nun,una suora,He;monk,un monaco,17.098323692758395,17.098323692758395,Poor,Poor,Incorrect,Correct
216,"Her term in the Jakarta Council automatically expired due to KPU regulations on 20 September 2018, when she was officially registered as a candidate for the People's Representative Council.","Il suo mandato nel Consiglio di Giakarta è scaduto automaticamente a causa dei regolamenti KPU il 20 settembre 2018, quando è stata ufficialmente registrata come candidata al Consiglio di rappresentanza popolare.","Il suo periodo nel Jakarta Council scadde automaticamente a causa del regolamento KPU del 20 settembre 2018, quando fu ufficialmente registrata come candidata per il People's Representative Council.","His term in the Jakarta Council automatically expired due to KPU regulations on 20 September 2018, when he was officially registered as a candidate for the People's Representative Council.","Il suo mandato nel Consiglio di Giakarta è scaduto automaticamente a causa dei regolamenti della KPU il 20 settembre 2018, quando è stato ufficialmente registrato come candidato al Consiglio di rappresentanza del popolo.","Il suo periodo nel Jakarta Council scadde automaticamente a causa del regolamento KPU del 20 settembre 2018, quando fu ufficialmente registrato come candidato per il People's Representative Council.","<F>Her</F> term in the Jakarta Council automatically expired due to KPU regulations on 20 September 2018, when <F>she</F> was officially registered as a candidate for the People's Representative Council.","Il suo periodo nel Jakarta Council scadde automaticamente a causa del regolamento KPU del 20 settembre 2018, quando fu ufficialmente <F>registrata</F> come <F>candidata</F> per il People's Representative Council.","<M>His</M> term in the Jakarta Council automatically expired due to KPU regulations on 20 September 2018, when <M>he</M> was officially registered as a candidate for the People's Representative Council.","Il suo periodo nel Jakarta Council scadde automaticamente a causa del regolamento KPU del 20 settembre 2018, quando fu ufficialmente <M>registrato</M> come <M>candidato</M> per il People's Representative Council.",Her;she,registrata;candidata,His;he,registrato;candidato,23.96621968105552,22.8404053250115,Fair,Fair,Correct,Correct
217,Her various roles ranged from maids and ingénues to vamps and queens.,I suoi vari ruoli andavano da cameriere e ingenue a vampiri e regine.,I ruoli da lei interpretati spaziavano da cameriere e ragazze ingenue a vamp e regine.,His various roles ranged from manservants and ingénues to vamps and kings.,I suoi vari ruoli andavano da servitori e ingenui a vampiri e re.,I ruoli da lui interpretati spaziavano da camerieri e ragazzi ingenui a vamp e re.,<F>Her</F> various roles ranged from <F>maids</F> and <F>ingénues</F> to vamps and <F>queens</F>.,I ruoli da <F>lei</F> interpretati spaziavano da <F>cameriere</F> e <F>ragazze ingenue</F> a vamp e <F>regine</F>.,<M>His</M> various roles ranged from <M>manservants</M> and <M>ingénues</M> to vamps and <M>kings</M>.,I ruoli da <M>lui</M> interpretati spaziavano da <M>camerieri</M> e <M>ragazzi ingenui</M> a vamp e <M>re</M>.,Her;maids;ingénues;queens,lei;cameriere;ragazze ingenue;regine,His;manservants;ingénues;kings,lui;camerieri;ragazzi ingenui;re,18.51565595560746,13.346888841097716,Poor,Poor,Correct,Correct
218,"She was also offered lead roles in Working Girl, Jumpin' Jack Flash and My Stepmother Is an Alien, but did not accept those roles.","Le sono stati offerti anche ruoli da protagonista in Working Girl, Jumpin' Jack Flash e My Stepmother Is an Alien, ma non ha accettato quei ruoli.","Le furono anche offerti ruoli da protagonista in Una donna in carriera, Jumpin' Jack Flash e Ho sposato un'aliena, ma li rifiutò tutti.","He was also offered lead roles in Working Girl, Jumpin' Jack Flash and My Stepmother Is an Alien, but did not accept those roles.","Gli sono stati offerti anche ruoli da protagonista in Working Girl, Jumpin' Jack Flash e My Stepmother Is an Alien, ma non ha accettato quei ruoli.","Gli furono anche offerti ruoli da protagonista in Una donna in carriera, Jumpin' Jack Flash e Ho sposato un'aliena, ma li rifiutò tutti.","<F>She</F> was also offered lead roles in Working Girl, Jumpin' Jack Flash and My Stepmother Is an Alien, but did not accept those roles.","<F>Le</F> furono anche offerti ruoli da protagonista in Una donna in carriera, Jumpin' Jack Flash e Ho sposato un'aliena, ma li rifiutò tutti.","<M>He</M> was also offered lead roles in Working Girl, Jumpin' Jack Flash and My Stepmother Is an Alien, but did not accept those roles.","<M>Gli</M> furono anche offerti ruoli da protagonista in Una donna in carriera, Jumpin' Jack Flash e Ho sposato un'aliena, ma li rifiutò tutti.",She,Le,He,Gli,23.70526643522448,23.70526643522448,Fair,Fair,Correct,Correct
219,"She attended the University of Edinburgh, read Civil Law at the University of Leyden and was admitted to the Faculty of Advocates in 1727.","Frequentò l'Università di Edimburgo, studiò diritto civile all'Università di Leida e fu ammessa alla Facoltà di avvocati nel 1727.","Frequentò l'Università di Edimburgo, studiò diritto civile presso l'Università di Leyden e fu ammessa alla Faculty of Advocates nel 1727.","He attended the University of Edinburgh, read Civil Law at the University of Leyden and was admitted to the Faculty of Advocates in 1727.","Frequentò l'Università di Edimburgo, studiò diritto civile all'Università di Leida e fu ammesso alla Facoltà di avvocati nel 1727.","Frequentò l'Università di Edimburgo, studiò diritto civile presso l'Università di Leyden e fu ammesso alla Faculty of Advocates nel 1727.","<F>She</F> attended the University of Edinburgh, read Civil Law at the University of Leyden and was admitted to the Faculty of Advocates in 1727.","Frequentò l'Università di Edimburgo, studiò diritto civile presso l'Università di Leyden e fu <F>ammessa</F> alla Faculty of Advocates nel 1727.","<M>He</M> attended the University of Edinburgh, read Civil Law at the University of Leyden and was admitted to the Faculty of Advocates in 1727.","Frequentò l'Università di Edimburgo, studiò diritto civile presso l'Università di Leyden e fu <M>ammesso</M> alla Faculty of Advocates nel 1727.",She,ammessa,He,ammesso,49.42244290934039,49.42244290934039,Very good,Very good,Correct,Correct
220,The Linger or Queen Mother was head of all women and very influential in state politics.,La Linger o Regina Madre era a capo di tutte le donne e molto influente nella politica statale.,La Linger (Regina Madre) era a capo di tutte le donne e aveva grande influenza sulle politiche di Stato.,The Linger or King Father was head of all men and very influential in state politics.,Il Linger o Re Padre era il capo di tutti gli uomini e molto influente nella politica statale.,Il Linger (Re Padre) era a capo di tutti gli uomini e aveva grande influenza sulle politiche di Stato.,The Linger or <F>Queen</F> <F>Mother</F> was head of all <F>women</F> and very influential in state politics.,<F>La</F> Linger (<F>Regina Madre</F>) era a capo di <F>tutte le donne</F> e aveva grande influenza sulle politiche di Stato.,The Linger or <M>King</M> <M>Father</M> was head of all <M>men</M> and very influential in state politics.,<M>Il</M> Linger (<M>Re Padre</M>) era a capo di <M>tutti gli uomini</M> e aveva grande influenza sulle politiche di Stato.,Queen;Mother;women,La;Regina Madre;tutte le donne,King;Father;men,Il;Re Padre;tutti gli uomini,37.6361519848923,27.55139337277189,Good,Fair,Correct,Correct
221,"The enraged girl, who was 16 at the time, retaliated by shooting the policewoman through the heart.","La ragazza infuriata, che all'epoca aveva 16 anni, si vendicò sparando al cuore alla poliziotta.","La ragazza piena di rabbia, che all'epoca aveva 16 anni, si è vendicata sparando alla poliziotta un colpo dritto al cuore.","The enraged boy, who was 16 at the time, retaliated by shooting the policeman through the heart.","Il ragazzo infuriato, che all'epoca aveva 16 anni, ha reagito sparando al poliziotto al cuore.","Il ragazzo pieno di rabbia, che all'epoca aveva 16 anni, si è vendicato sparando al poliziotto un colpo dritto al cuore.","The enraged <F>girl</F>, who was 16 at the time, retaliated by shooting the <F>policewoman</F> through the heart.","<F>La ragazza piena</F> di rabbia, che all'epoca aveva 16 anni, si è <F>vendicata</F> sparando <F>alla poliziotta</F> un colpo dritto al cuore.","The enraged <M>boy</M>, who was 16 at the time, retaliated by shooting the <M>policeman</M> through the heart.","<M>Il ragazzo pieno</M> di rabbia, che all'epoca aveva 16 anni, si è <M>vendicato</M> sparando <M>al poliziotto</M> un colpo dritto al cuore.",girl;policewoman,La ragazza piena;vendicata;alla poliziotta,boy;policeman,Il ragazzo pieno;vendicato;al poliziotto,36.22949787916289,35.88496273230126,Good,Good,Correct,Correct
222,"She was appointed Archdeacon of Lismore in 1788, serving until 1810 when she exchanged it for the Prebendary of Kilrossanty in Lismore Cathedral.","Fu nominata Arcidiacono di Lismore nel 1788, prestando servizio fino al 1810 quando lo scambiò con il Prebendario di Kilrossanty nella cattedrale di Lismore.","Fu nominata arcidiacono di Lismore nel 1788, servendo fino al 1810 quando cambiò per cappellana di Kilrossanty nella cattedrale di Lismore.","He was appointed Archdeacon of Lismore in 1788, serving until 1810 when he exchanged it for the Prebendary of Kilrossanty in Lismore Cathedral.","Fu nominato Arcidiacono di Lismore nel 1788, prestando servizio fino al 1810 quando lo scambiò con il Prebendario di Kilrossanty nella cattedrale di Lismore.","Fu nominato arcidiacono di Lismore nel 1788, servendo fino al 1810 quando cambiò per cappellano di Kilrossanty nella cattedrale di Lismore.","<F>She</F> was appointed Archdeacon of Lismore in 1788, serving until 1810 when <F>she</F> exchanged it for the Prebendary of Kilrossanty in Lismore Cathedral.","Fu <F>nominata</F> arcidiacono di Lismore nel 1788, servendo fino al 1810 quando cambiò per <F>cappellana</F> di Kilrossanty nella cattedrale di Lismore.","<M>He</M> was appointed Archdeacon of Lismore in 1788, serving until 1810 when <M>he</M> exchanged it for the Prebendary of Kilrossanty in Lismore Cathedral.","Fu <M>nominato</M> arcidiacono di Lismore nel 1788, servendo fino al 1810 quando cambiò per <M>cappellano</M> di Kilrossanty nella cattedrale di Lismore.",She;she,nominata;cappellana,He;he,nominato;cappellano,47.08814006796008,47.08814006796008,Very good,Very good,Correct,Correct
223,"Lee's novel, Somebody's Daughter (2005), is based on her year as a Fulbright Scholar to South Korea, taking oral histories of Korean birth mothers.","Il romanzo di Lee, Somebody's Daughter (2005), è basato sul suo anno come borsista Fulbright in Corea del Sud, raccogliendo storie orali di madri naturali coreane.","Il romanzo di Lee, Somebody's Daughter (2005) è basato sul suo anno come ricercatrice della Fulbright in Corea del Sud, ascoltando storie orali di madri di nascita coreana.","Lee's novel, Somebody's Daughter (2005), is based on his year as a Fulbright Scholar to South Korea, taking oral histories of Korean birth fathers.","Il romanzo di Lee, Somebody's Daughter (2005), è basato sul suo anno come borsista Fulbright in Corea del Sud, raccogliendo le storie orali dei padri naturali coreani.","Il romanzo di Lee, Somebody's Daughter (2005) è basato sul suo anno come ricercatore della Fulbright in Corea del Sud, ascoltando storie orali di padri di nascita coreana.","Lee's novel, Somebody's Daughter (2005), is based on <F>her</F> year as a Fulbright Scholar to South Korea, taking oral histories of Korean birth <F>mothers</F>.","Il romanzo di Lee, Somebody's Daughter (2005) è basato sul suo anno come <F>ricercatrice</F> della Fulbright in Corea del Sud, ascoltando storie orali di <F>madri</F> di nascita coreana.","Lee's novel, Somebody's Daughter (2005), is based on <M>his</M> year as a Fulbright Scholar to South Korea, taking oral histories of Korean birth <M>fathers</M>.","Il romanzo di Lee, Somebody's Daughter (2005) è basato sul suo anno come <M>ricercatore</M> della Fulbright in Corea del Sud, ascoltando storie orali di <M>padri</M> di nascita coreana.",her;mothers,ricercatrice;madri,his;fathers,ricercatore;padri,62.54855955640856,57.60762262605324,Excellent,Excellent,Correct,Correct
