orig_id,source_feminine,translate_feminine,reference_feminine,source_masculine,translate_masculine,reference_masculine,source_feminine_annotated,reference_feminine_annotated,source_masculine_annotated,reference_masculine_annotated,source_feminine_keywords,reference_feminine_keywords,source_masculine_keywords,reference_masculine_keywords,scores_f_bleu,scores_m_bleu,f_quality_bins,m_quality_bins,decision_f,decision_m
215,The Russian Tsarina generously noted the first major victory in the French invasion of Russia.,Die russische Zarin nahm großzügig den ersten großen Sieg bei der französischen Invasion in Russland zur Kenntnis.,Die russische Zarin nahm den ersten großen Sieg bei der französischen Invasion in Russland großzügig zur Kenntnis.,The Russian Tsar generously noted the first major victory in the French invasion of Russia.,Der russische Zar nahm großzügig den ersten großen Sieg bei der französischen Invasion in Russland zur Kenntnis.,Der russische Zar nahm den ersten großen Sieg bei der französischen Invasion in Russland großzügig zur Kenntnis.,The Russian <F>Tsarina</F> generously noted the first major victory in the French invasion of Russia.,<F>Die</F> russische <F>Zarin</F> nahm den ersten großen Sieg bei der französischen Invasion in Russland großzügig zur Kenntnis.,The Russian <M>Tsar</M> generously noted the first major victory in the French invasion of Russia.,<M>Der</M> russische <M>Zar</M> nahm den ersten großen Sieg bei der französischen Invasion in Russland großzügig zur Kenntnis.,Tsarina,Die;Zarin,Tsar,Der;Zar,74.12891374350545,74.12891374350545,Excellent,Excellent,Correct,Correct
216,"They would sing freely for their goddess and dance following the rhythm of the music as it came, until the flame was extinguished.","Sie sangen frei für ihre Göttin und tanzten im Rhythmus der Musik, bis die Flamme erloschen war.","Sie sangen ausgelassen für ihre Göttin und tanzten im Rhythmus der Musik, bis die Flamme erloschen war.","They would sing freely for their god and dance following the rhythm of the music as it came, until the flame was extinguished.","Sie sangen frei für ihren Gott und tanzten im Rhythmus der Musik, bis die Flamme erloschen war.","Sie sangen ausgelassen für ihren Gott und tanzten im Rhythmus der Musik, bis die Flamme erloschen war.","They would sing freely for their <F>goddess</F> and dance following the rhythm of the music as it came, until the flame was extinguished.","Sie sangen ausgelassen für <F>ihre Göttin</F> und tanzten im Rhythmus der Musik, bis die Flamme erloschen war.","They would sing freely for their <M>god</M> and dance following the rhythm of the music as it came, until the flame was extinguished.","Sie sangen ausgelassen für <M>ihren Gott</M> und tanzten im Rhythmus der Musik, bis die Flamme erloschen war.",goddess,ihre Göttin,god,ihren Gott,86.63975517813623,86.63975517813623,Excellent,Excellent,Correct,Correct
217,"In 1970, she received a certification from the National Athletic Trainers Association.",1970 erhielt sie eine Zertifizierung der National Athletic Trainers Association.,Im Jahr 1970 erhielt sie eine Zertifizierung der National Athletic Trainers Association.,"In 1970, he received a certification from the National Athletic Trainers Association.",1970 erhielt er eine Zertifizierung der National Athletic Trainers Association.,Im Jahr 1970 erhielt er eine Zertifizierung der National Athletic Trainers Association.,"In 1970, <F>she</F> received a certification from the National Athletic Trainers Association.",Im Jahr 1970 erhielt <F>sie</F> eine Zertifizierung der National Athletic Trainers Association.,"In 1970, <M>he</M> received a certification from the National Athletic Trainers Association.",Im Jahr 1970 erhielt <M>er</M> eine Zertifizierung der National Athletic Trainers Association.,she,sie,he,er,83.37529180751808,83.37529180751808,Excellent,Excellent,Correct,Correct
218,"Lady Ashcroft found at the 2010 election, only 16% of ethnic minority voters supported the Conservatives.","Lady Ashcroft stellte bei der Wahl 2010 fest, dass nur 16 % der Wähler ethnischer Minderheiten die Konservativen unterstützten.","Lady Ashcroft stellte fest, dass in der Wahl 2010 nur 16 % der Wähler aus ethnischen Minderheiten die Konservativen unterstützten.","Lord Ashcroft found at the 2010 election, only 16% of ethnic minority voters supported the Conservatives.","Lord Ashcroft stellte bei der Wahl 2010 fest, dass nur 16 % der Wähler ethnischer Minderheiten die Konservativen unterstützten.","Lord Ashcroft stellte fest, dass in der Wahl 2010 nur 16 % der Wähler aus ethnischen Minderheiten die Konservativen unterstützten.","<F>Lady</F> Ashcroft found at the 2010 election, only 16% of ethnic minority voters supported the Conservatives.","<F>Lady</F> Ashcroft stellte fest, dass in der Wahl 2010 nur 16 % der Wähler aus ethnischen Minderheiten die Konservativen unterstützten.","<M>Lord</M> Ashcroft found at the 2010 election, only 16% of ethnic minority voters supported the Conservatives.","<M>Lord</M> Ashcroft stellte fest, dass in der Wahl 2010 nur 16 % der Wähler aus ethnischen Minderheiten die Konservativen unterstützten.",Lady,Lady,Lord,Lord,48.4503028016591,48.4503028016591,Very good,Very good,Correct,Correct
219,"As the deputy chairwoman, Ikoku argued that Abacha was free to succeed herself if the political parties agree to draft her as their presidential candidate.","Als stellvertretende Vorsitzende argumentierte Ikoku, dass es Abacha freisteht, ihre Nachfolge anzutreten, wenn die politischen Parteien zustimmen, sie als ihre Präsidentschaftskandidatin zu nominieren.","Als stellvertretende Vorsitzende argumentierte Ikoku, dass es Abacha freistehe, ihre Nachfolge anzutreten, wenn die politischen Parteien sie als Präsidentschaftskandidatin aufstellten.","As the deputy chairman, Ikoku argued that Abacha was free to succeed himself if the political parties agree to draft him as their presidential candidate.","Als stellvertretender Vorsitzender argumentierte Ikoku, dass es Abacha freistehe, selbst die Nachfolge anzutreten, wenn die politischen Parteien zustimmten, ihn als ihren Präsidentschaftskandidaten zu nominieren.","Als stellvertretender Vorsitzender argumentierte Ikoku, dass es Abacha freistehe, seine Nachfolge anzutreten, wenn die politischen Parteien ihn als Präsidentschaftskandidaten aufstellten.","As the deputy <F>chairwoman</F>, Ikoku argued that Abacha was free to succeed <F>herself</F> if the political parties agree to draft <F>her</F> as their presidential candidate.","Als <F>stellvertretende Vorsitzende</F> argumentierte Ikoku, dass es Abacha freistehe, <F>ihre</F> Nachfolge anzutreten, wenn die politischen Parteien <F>sie</F> als <F>Präsidentschaftskandidatin</F> aufstellten.","As the deputy <M>chairman</M>, Ikoku argued that Abacha was free to succeed <M>himself</M> if the political parties agree to draft <M>him</M> as their presidential candidate.","Als <M>stellvertretender Vorsitzender</M> argumentierte Ikoku, dass es Abacha freistehe, <M>seine</M> Nachfolge anzutreten, wenn die politischen Parteien <M>ihn</M> als <M>Präsidentschaftskandidaten</M> aufstellten.",chairwoman;herself;her,stellvertretende Vorsitzende;ihre;sie;Präsidentschaftskandidatin,chairman;himself;him,stellvertretender Vorsitzender;seine;ihn;Präsidentschaftskandidaten,59.79796889571919,57.61982509413807,Excellent,Excellent,Correct,Correct
220,"She was critical of mothers who do not fulfill this role: We have moms today that are interested in sports, business, and sex.","Kritisch äußerte sie sich gegenüber Müttern, die diese Rolle nicht erfüllen: „Wir haben heute Mütter, die sich für Sport, Business und Sex interessieren.“","Sie kritisierte die Mütter, die diese Rolle nicht ausfüllen: Wir haben heute Mütter, die sich für Sport, Wirtschaft und Sex interessieren.","He was critical of fathers who do not fulfill this role: We have dads today that are interested in sports, business, and sex.","Kritisch äußerte er sich gegenüber Vätern, die diese Rolle nicht erfüllen: „Wir haben heute Väter, die sich für Sport, Business und Sex interessieren.“","Er kritisierte die Väter, die diese Rolle nicht ausfüllen: Wir haben heute Väter, die sich für Sport, Wirtschaft und Sex interessieren.","<F>She</F> was critical of <F>mothers</F> who do not fulfill this role: We have <F>moms</F> today that are interested in sports, business, and sex.","<F>Sie</F> kritisierte die <F>Mütter</F>, die diese Rolle nicht ausfüllen: Wir haben heute <F>Mütter</F>, die sich für Sport, Wirtschaft und Sex interessieren.","<M>He</M> was critical of <M>fathers</M> who do not fulfill this role: We have <M>dads</M> today that are interested in sports, business, and sex.","<M>Er</M> kritisierte die <M>Väter</M>, die diese Rolle nicht ausfüllen: Wir haben heute <M>Väter</M>, die sich für Sport, Wirtschaft und Sex interessieren.",She;mothers;moms,Sie;Mütter;Mütter,He;fathers;dads,Er;Väter;Väter,48.205197721556935,48.205197721556935,Very good,Very good,Correct,Correct
221,"The kind of speech act or event; for the example used here, the kind of story - The aunt might tell a character anecdote about the grandmother for entertainment, or an exemplum as moral instruction.",Die Art des Sprechakts oder Ereignisses; Für das hier verwendete Beispiel handelt es sich um die Art der Geschichte: Die Tante könnte zur Unterhaltung eine Charakteranekdote über die Großmutter erzählen oder ein Beispiel als moralische Belehrung.,Die Art der Sprechhandlung oder des Ereignisses; in dem hier verwendeten Beispiel die Art der Geschichte - Die Tante könnte zur Unterhaltung eine Anekdote über die Großmutter erzählen oder ein Beispiel geben als moralische Belehrung.,"The kind of speech act or event; for the example used here, the kind of story - The uncle might tell a character anecdote about the grandfather for entertainment, or an exemplum as moral instruction.",Die Art des Sprechakts oder Ereignisses; Für das hier verwendete Beispiel handelt es sich um die Art der Geschichte: Der Onkel könnte zur Unterhaltung eine Charakteranekdote über den Großvater erzählen oder ein Beispiel als moralische Belehrung.,Die Art der Sprechhandlung oder des Ereignisses; in dem hier verwendeten Beispiel die Art der Geschichte - Der Onkel könnte zur Unterhaltung eine Anekdote über den Großvater erzählen oder ein Beispiel geben als moralische Belehrung.,"The kind of speech act or event; for the example used here, the kind of story - The <F>aunt</F> might tell a character anecdote about the <F>grandmother</F> for entertainment, or an exemplum as moral instruction.",Die Art der Sprechhandlung oder des Ereignisses; in dem hier verwendeten Beispiel die Art der Geschichte - <F>Die Tante</F> könnte zur Unterhaltung eine Anekdote über <F>die Großmutter</F> erzählen oder ein Beispiel geben als moralische Belehrung.,"The kind of speech act or event; for the example used here, the kind of story - The <M>uncle</M> might tell a character anecdote about the <M>grandfather</M> for entertainment, or an exemplum as moral instruction.",Die Art der Sprechhandlung oder des Ereignisses; in dem hier verwendeten Beispiel die Art der Geschichte - <M>Der Onkel</M> könnte zur Unterhaltung eine Anekdote über <M>den Großvater</M> erzählen oder ein Beispiel geben als moralische Belehrung.,aunt;grandmother,Die Tante;die Großmutter,uncle;grandfather,Der Onkel;den Großvater,42.51050439969978,42.51050439969978,Very good,Very good,Correct,Correct
222,"In this view, the title half queen was probably a British invention, and her subsequent lofty historical role as a Six Nations 'regnant' or 'vicereine' in the Ohio Country was the product of later generations of scholars.","Aus dieser Sicht war der Titel Halbkönigin wahrscheinlich eine britische Erfindung, und ihre spätere hohe historische Rolle als „Regierende“ oder „Vizekönigin“ der Sechs Nationen im Ohio-Land war das Produkt späterer Generationen von Gelehrten.","Nach dieser Auffassung war der Titel „halbe Königin“ wahrscheinlich eine britische Erfindung, und ihre spätere erhabene historische Rolle als „Regentin“ oder „Vizekönigin“ der Sechs Nationen im Ohiogebiet war das Ergebnis späterer Gelehrtengenerationen.","In this view, the title half king was probably a British invention, and his subsequent lofty historical role as a Six Nations 'regent' or 'viceroy' in the Ohio Country was the product of later generations of scholars.","Aus dieser Sicht war der Titel Halbkönig wahrscheinlich eine britische Erfindung, und seine spätere hohe historische Rolle als „Regent“ oder „Vizekönig“ der Sechs Nationen im Ohio-Land war das Produkt späterer Generationen von Gelehrten.","Nach dieser Auffassung war der Titel „halber König“ wahrscheinlich eine britische Erfindung, und seine spätere erhabene historische Rolle als „Regent“ oder „Vizekönig“ der Sechs Nationen im Ohiogebiet war das Ergebnis späterer Gelehrtengenerationen.","In this view, the title half <F>queen</F> was probably a British invention, and <F>her</F> subsequent lofty historical role as a Six Nations '<F>regnant</F>' or '<F>vicereine</F>' in the Ohio Country was the product of later generations of scholars.","Nach dieser Auffassung war der Titel „<F>halbe Königin</F>“ wahrscheinlich eine britische Erfindung, und <F>ihre</F> spätere erhabene historische Rolle als „<F>Regentin</F>“ oder „<F>Vizekönigin</F>“ der Sechs Nationen im Ohiogebiet war das Ergebnis späterer Gelehrtengenerationen.","In this view, the title half <M>king</M> was probably a British invention, and <M>his</M> subsequent lofty historical role as a Six Nations '<M>regent</M>' or '<M>viceroy</M>' in the Ohio Country was the product of later generations of scholars.","Nach dieser Auffassung war der Titel „<M>halber König</M>“ wahrscheinlich eine britische Erfindung, und <M>seine</M> spätere erhabene historische Rolle als „<M>Regent</M>“ oder „<M>Vizekönig</M>“ der Sechs Nationen im Ohiogebiet war das Ergebnis späterer Gelehrtengenerationen.",queen;her;regnant;vicereine,halbe Königin;ihre;Regentin;Vizekönigin,king;his;regent;viceroy,halber König;seine;Regent;Vizekönig,42.44849732783386,51.57593900658648,Very good,Excellent,Correct,Correct
223,We had to repair our relationship because I wanted my mother back.,"Wir mussten unsere Beziehung reparieren, weil ich meine Mutter zurück wollte.","Wir mussten unsere Beziehung reparieren, weil ich meine Mutter zurückhaben wollte.",We had to repair our relationship because I wanted my father back.,"Wir mussten unsere Beziehung reparieren, weil ich meinen Vater zurück wollte.","Wir mussten unsere Beziehung reparieren, weil ich meinen Vater zurückhaben wollte.",We had to repair our relationship because I wanted my <F>mother</F> back.,"Wir mussten unsere Beziehung reparieren, weil ich <F>meine Mutter</F> zurückhaben wollte.",We had to repair our relationship because I wanted my <M>father</M> back.,"Wir mussten unsere Beziehung reparieren, weil ich <M>meinen Vater</M> zurückhaben wollte.",mother,meine Mutter,father,meinen Vater,79.10665071754353,79.10665071754353,Excellent,Excellent,Correct,Correct
224,After a successful career she moved over to Hollywood films at the age of 72.,Nach einer erfolgreichen Karriere wechselte sie im Alter von 72 Jahren zu Hollywood-Filmen.,Nach einer erfolgreichen Karriere schwenkte sie im Alter von 72 Jahren auf Hollywood-Filme um.,After a successful career he moved over to Hollywood films at the age of 72.,Nach einer erfolgreichen Karriere wechselte er im Alter von 72 Jahren zu Hollywood-Filmen.,Nach einer erfolgreichen Karriere schwenkte er im Alter von 72 Jahren auf Hollywood-Filme um.,After a successful career <F>she</F> moved over to Hollywood films at the age of 72.,Nach einer erfolgreichen Karriere schwenkte <F>sie</F> im Alter von 72 Jahren auf Hollywood-Filme um.,After a successful career <M>he</M> moved over to Hollywood films at the age of 72.,Nach einer erfolgreichen Karriere schwenkte <M>er</M> im Alter von 72 Jahren auf Hollywood-Filme um.,she,sie,he,er,50.698033524721,50.698033524721,Excellent,Excellent,Correct,Correct
225,"Terms being proposed which she accepted, a treaty was drawn up and signed at Fort Bullen on 4 January 1832, ending the war.","Nachdem Bedingungen vorgeschlagen wurden, die sie akzeptierte, wurde am 4. Januar 1832 in Fort Bullen ein Vertrag ausgearbeitet und unterzeichnet, der den Krieg beendete.","Nachdem ihr Bedingungen vorgeschlagen wurden, die sie akzeptierte, wurde ein Vertrag ausgearbeitet, der den Krieg beendete und am 4. Januar 1832 in Fort Bullen unterzeichnet wurde.","Terms being proposed which he accepted, a treaty was drawn up and signed at Fort Bullen on 4 January 1832, ending the war.","Nachdem Bedingungen vorgeschlagen wurden, die er akzeptierte, wurde am 4. Januar 1832 in Fort Bullen ein Vertrag ausgearbeitet und unterzeichnet, der den Krieg beendete.","Nachdem ihm Bedingungen vorgeschlagen wurden, die er akzeptierte, wurde ein Vertrag ausgearbeitet, der den Krieg beendete und am 4. Januar 1832 in Fort Bullen unterzeichnet wurde.","Terms being proposed which <F>she</F> accepted, a treaty was drawn up and signed at Fort Bullen on 4 January 1832, ending the war.","Nachdem <F>ihr</F> Bedingungen vorgeschlagen wurden, die <F>sie</F> akzeptierte, wurde ein Vertrag ausgearbeitet, der den Krieg beendete und am 4. Januar 1832 in Fort Bullen unterzeichnet wurde.","Terms being proposed which <M>he</M> accepted, a treaty was drawn up and signed at Fort Bullen on 4 January 1832, ending the war.","Nachdem <M>ihm</M> Bedingungen vorgeschlagen wurden, die <M>er</M> akzeptierte, wurde ein Vertrag ausgearbeitet, der den Krieg beendete und am 4. Januar 1832 in Fort Bullen unterzeichnet wurde.",she,ihr;sie,he,ihm;er,65.06205293312715,65.06205293312715,Excellent,Excellent,Correct,Correct
226,"A delegation of ladies comes to their island, asking that Suth will return to the capital and oversee the election of a new empress, since the current one is dying.","Eine Delegation von Damen kommt auf ihre Insel und bittet Suth, in die Hauptstadt zurückzukehren und die Wahl einer neuen Kaiserin zu überwachen, da die derzeitige im Sterben liegt.","Eine Delegation von Ladies kommt auf ihre Insel und bittet darum, dass Suth in die Hauptstadt zurückkehrt und die Wahl einer neuen Kaiserin beaufsichtigt, da die derzeitige im Sterben liegt.","A delegation of lords comes to their island, asking that Suth will return to the capital and oversee the election of a new emperor, since the current one is dying.","Eine Delegation von Lords kommt auf ihre Insel und bittet Suth, in die Hauptstadt zurückzukehren und die Wahl eines neuen Kaisers zu überwachen, da der derzeitige im Sterben liegt.","Eine Delegation von Lords kommt auf ihre Insel und bittet darum, dass Suth in die Hauptstadt zurückkehrt und die Wahl eines neuen Kaisers beaufsichtigt, da der derzeitige im Sterben liegt.","A delegation of <F>ladies</F> comes to their island, asking that Suth will return to the capital and oversee the election of a new <F>empress</F>, since the current one is dying.","Eine Delegation von <F>Ladies</F> kommt auf ihre Insel und bittet darum, dass Suth in die Hauptstadt zurückkehrt und die Wahl <F>einer</F> neuen <F>Kaiserin</F> beaufsichtigt, da <F>die</F> derzeitige im Sterben liegt.","A delegation of <M>lords</M> comes to their island, asking that Suth will return to the capital and oversee the election of a new <M>emperor</M>, since the current one is dying.","Eine Delegation von <M>Lords</M> kommt auf ihre Insel und bittet darum, dass Suth in die Hauptstadt zurückkehrt und die Wahl <M>eines</M> neuen <M>Kaisers</M> beaufsichtigt, da <M>der</M> derzeitige im Sterben liegt.",ladies;empress,Ladies;einer;Kaiserin;die,lords;emperor,Lords;eines;Kaisers;der,57.035212598874885,66.39926006366433,Excellent,Excellent,Correct,Correct
227,In the British Empire Exhibition of 1924/25 she exhibited an electric regulator and electric turret movement.,Auf der British Empire Exhibition 1924/25 stellte sie einen elektrischen Regulator und ein elektrisches Turmwerk aus.,Auf der British Empire Exhibition von 1924/25 stellte sie einen elektrischen Regulator und ein elektrisches Turmuhrwerk aus.,In the British Empire Exhibition of 1924/25 he exhibited an electric regulator and electric turret movement.,Auf der British Empire Exhibition 1924/25 stellte er einen elektrischen Regulator und ein elektrisches Turmwerk aus.,Auf der British Empire Exhibition von 1924/25 stellte er einen elektrischen Regulator und ein elektrisches Turmuhrwerk aus.,In the British Empire Exhibition of 1924/25 <F>she</F> exhibited an electric regulator and electric turret movement.,Auf der British Empire Exhibition von 1924/25 stellte <F>sie</F> einen elektrischen Regulator und ein elektrisches Turmuhrwerk aus.,In the British Empire Exhibition of 1924/25 <M>he</M> exhibited an electric regulator and electric turret movement.,Auf der British Empire Exhibition von 1924/25 stellte <M>er</M> einen elektrischen Regulator und ein elektrisches Turmuhrwerk aus.,she,sie,he,er,72.88361338482602,72.88361338482602,Excellent,Excellent,Correct,Correct
228,"Upon leaving school, she returned to the family home in Bromley, Kent, and became active in suffragette activities, but realised that she was not cut out to be a leader in the field of women's rights.","Nach dem Schulabschluss kehrte sie in das Haus ihrer Familie in Bromley, Kent, zurück und engagierte sich aktiv für Frauenrechtlerinnen, erkannte jedoch, dass sie nicht dazu geeignet war, eine Führungspersönlichkeit im Bereich der Frauenrechte zu sein.","Nach ihrem Schulabschluss kehrte sie in ihr Elternhaus in Bromley, Kent, zurück und engagierte sich in der Suffragettenbewegung, erkannte aber, dass sie nicht für eine führende Rolle im Bereich der Frauenrechte geeignet war.","Upon leaving school, he returned to the family home in Bromley, Kent, and became active in suffragette activities, but realised that he was not cut out to be a leader in the field of men's rights.","Nach dem Schulabschluss kehrte er in das Haus seiner Familie in Bromley, Kent, zurück und engagierte sich aktiv für Frauenrechtlerinnen, erkannte jedoch, dass er nicht dazu geeignet war, eine Führungspersönlichkeit im Bereich der Männerrechte zu sein.","Nach seinem Schulabschluss kehrte er in sein Elternhaus in Bromley, Kent, zurück und engagierte sich in der Suffragettenbewegung, erkannte aber, dass er nicht für eine führende Rolle im Bereich der Männerrechte geeignet war.","Upon leaving school, <F>she</F> returned to the family home in Bromley, Kent, and became active in suffragette activities, but realised that <F>she</F> was not cut out to be a leader in the field of <F>women</F>'s rights.","Nach <F>ihrem</F> Schulabschluss kehrte <F>sie</F> in <F>ihr</F> Elternhaus in Bromley, Kent, zurück und engagierte sich in der Suffragettenbewegung, erkannte aber, dass <F>sie</F> nicht für eine führende Rolle im Bereich der <F>Frauenrechte</F> geeignet war.","Upon leaving school, <M>he</M> returned to the family home in Bromley, Kent, and became active in suffragette activities, but realised that <M>he</M> was not cut out to be a leader in the field of <M>men</M>'s rights.","Nach <M>seinem</M> Schulabschluss kehrte <M>er</M> in <M>sein</M> Elternhaus in Bromley, Kent, zurück und engagierte sich in der Suffragettenbewegung, erkannte aber, dass <M>er</M> nicht für eine führende Rolle im Bereich der <M>Männerrechte</M> geeignet war.",she;she;women,ihrem;sie;ihr;sie;Frauenrechte,he;he;men,seinem;er;sein;er;Männerrechte,39.359079123898674,39.69408021438304,Good,Good,Correct,Correct
229,The Washington establishment was not too surprised when she dropped out of the race.,"Das Washingtoner Establishment war nicht allzu überrascht, als sie aus dem Rennen ausschied.","Das Washingtoner Establishment war nicht sonderlich überrascht davon, dass sie aus dem Rennen ausschied.",The Washington establishment was not too surprised when he dropped out of the race.,"Das Washingtoner Establishment war nicht allzu überrascht, als er aus dem Rennen ausschied.","Das Washingtoner Establishment war nicht sonderlich überrascht davon, dass er aus dem Rennen ausschied.",The Washington establishment was not too surprised when <F>she</F> dropped out of the race.,"Das Washingtoner Establishment war nicht sonderlich überrascht davon, dass <F>sie</F> aus dem Rennen ausschied.",The Washington establishment was not too surprised when <M>he</M> dropped out of the race.,"Das Washingtoner Establishment war nicht sonderlich überrascht davon, dass <M>er</M> aus dem Rennen ausschied.",she,sie,he,er,55.62557813671719,55.62557813671719,Excellent,Excellent,Correct,Correct
