orig_id,source_feminine,translate_feminine,reference_feminine,source_masculine,translate_masculine,reference_masculine,source_feminine_annotated,reference_feminine_annotated,source_masculine_annotated,reference_masculine_annotated,source_feminine_keywords,reference_feminine_keywords,source_masculine_keywords,reference_masculine_keywords,scores_f_bleu,scores_m_bleu,f_quality_bins,m_quality_bins,decision_f,decision_m
0,Shelton became one of Fort Worth's first female real estate developers and homebuilders.,Shelton è diventata una delle prime donne promotrici immobiliari e costruttrici di case di Fort Worth.,Shelton divenne una delle prime sviluppatrici immobiliari e costruttrici di Fort Worth.,Shelton became one of Fort Worth's first male real estate developers and homebuilders.,Shelton è diventato uno dei primi sviluppatori immobiliari e costruttori di case maschi di Fort Worth.,Shelton divenne uno dei primi sviluppatori immobiliari e costruttori di Fort Worth.,Shelton became one of Fort Worth's first <F>female</F> real estate developers and homebuilders.,Shelton divenne <F>una delle prime sviluppatrici</F> immobiliari e <F>costruttrici</F> di Fort Worth.,Shelton became one of Fort Worth's first <M>male</M> real estate developers and homebuilders.,Shelton divenne <M>uno dei primi sviluppatori</M> immobiliari e <M>costruttori</M> di Fort Worth.,female,una delle prime sviluppatrici;costruttrici,male,uno dei primi sviluppatori;costruttori,35.23089031737454,56.35190098079901,Good,Excellent,Correct,Correct
1,"My mom played for Leinster, my aunt played for Leinster, my cousin played for Leinster.","Mia madre giocava per il Leinster, mia zia giocava per il Leinster, mia cugina giocava per il Leinster.","Mia madre, mia zia, mio cugina hanno giocato nel Leinster.","My dad played for Leinster, my uncle played for Leinster, my cousin played for Leinster.","Mio padre giocava per il Leinster, mio ​​zio giocava per il Leinster, mio ​​cugino giocava per il Leinster.","Mio padre, mio zio, mio cugino hanno giocato nel Leinster.","My <F>mom</F> played for Leinster, my <F>aunt</F> played for Leinster, my cousin played for Leinster.","<F>Mia madre, mia zia, mio cugina</F> hanno giocato nel Leinster.","My <M>dad</M> played for Leinster, my <M>uncle</M> played for Leinster, my cousin played for Leinster.","<M>Mio padre, mio zio, mio cugino</M> hanno giocato nel Leinster.",mom;aunt,"Mia madre, mia zia, mio cugina",dad;uncle,"Mio padre, mio zio, mio cugino",10.580331550093844,7.264339766175721,Poor,Useless,Correct,Correct
2,"In 1512, as papal legate for Italy and Germany, she was; appointed commander of a Swiss and Venetian army, drove the French from Milan and established Maximilian Sforza as duchess.","Nel 1512, legata pontificia per l'Italia e la Germania, fu; nominato comandante di un esercito svizzero e veneziano, scacciò i francesi da Milano e stabilì Massimiliano Sforza come duchessa.","Nel 1512, come legato pontificio per l'Italia e la Germania, lei fu nominata comandante di un esercito svizzero e veneziano, cacciò i francesi da Milano e nominò Massimiliano Sforza nel ruolo di duchessa.","In 1512, as papal legate for Italy and Germany, he was; appointed commander of a Swiss and Venetian army, drove the French from Milan and established Maximilian Sforza as duke.","Nel 1512, legato pontificio per l'Italia e la Germania, fu; nominato comandante di un esercito svizzero e veneziano, scacciò i francesi da Milano e nominò duca Massimiliano Sforza.","Nel 1512, come legato pontificio per l'Italia e la Germania, lui fu nominato comandante di un esercito svizzero e veneziano, cacciò i francesi da Milano e nominò Massimiliano Sforza nel ruolo di duca.","In 1512, as papal legate for Italy and Germany, <F>she</F> was; appointed commander of a Swiss and Venetian army, drove the French from Milan and established Maximilian Sforza as <F>duchess</F>.","Nel 1512, come legato pontificio per l'Italia e la Germania, <F>lei</F> fu <F>nominata</F> comandante di un esercito svizzero e veneziano, cacciò i francesi da Milano e nominò Massimiliano Sforza nel ruolo di <F>duchessa</F>.","In 1512, as papal legate for Italy and Germany, <M>he</M> was; appointed commander of a Swiss and Venetian army, drove the French from Milan and established Maximilian Sforza as <M>duke</M>.","Nel 1512, come legato pontificio per l'Italia e la Germania, <M>lui</M> fu <M>nominato</M> comandante di un esercito svizzero e veneziano, cacciò i francesi da Milano e nominò Massimiliano Sforza nel ruolo di <M>duca</M>.",she;duchess,lei;nominata;duchessa,he;duke,lui;nominato;duca,47.16640567997811,57.93540477616802,Very good,Excellent,Incorrect,Correct
3,"The Stroganov chronicle says that On was killed by a chieftess called Chingi who spared Taibuga, sent her to fight the Ostyaks and granted her her own principality.","La cronaca di Stroganov dice che On fu uccisa da una capotessa chiamata Chingi che risparmiò Taibuga, la mandò a combattere gli Ostyak e le concesse il proprio principato.","La cronaca di Stroganov narra che On fu uccisa da una capa di nome Chingi che risparmiò Taibuga, la mandò a combattere gli Ostyak e le concesse il suo principato.","The Stroganov chronicle says that On was killed by a chief called Chingi who spared Taibuga, sent him to fight the Ostyaks and granted him his own principality.","La cronaca di Stroganov dice che On fu ucciso da un capo chiamato Chingi che risparmiò Taibuga, lo mandò a combattere gli Ostyak e gli concesse il proprio principato.","La cronaca di Stroganov narra che On fu ucciso da un capo di nome Chingi che risparmiò Taibuga, lo mandò a combattere gli Ostyak e gli concesse il suo principato.","The Stroganov chronicle says that On was killed by a <F>chieftess</F> called Chingi who spared Taibuga, sent <F>her</F> to fight the Ostyaks and granted <F>her</F> <F>her</F> own principality.","La cronaca di Stroganov narra che On fu <F>uccisa</F> da <F>una capa</F> di nome Chingi che risparmiò Taibuga, <F>la</F> mandò a combattere gli Ostyak e <F>le</F> concesse il suo principato.","The Stroganov chronicle says that On was killed by a <M>chief</M> called Chingi who spared Taibuga, sent <M>him</M> to fight the Ostyaks and granted <M>him</M> <M>his</M> own principality.","La cronaca di Stroganov narra che On fu <M>ucciso</M> da <M>un capo</M> di nome Chingi che risparmiò Taibuga, <M>lo</M> mandò a combattere gli Ostyak e <M>gli</M> concesse il suo principato.",chieftess;her;her;her,uccisa;una capa;la;le,chief;him;him;his,ucciso;un capo;lo;gli,68.46554224121219,71.81130245174309,Excellent,Excellent,Correct,Correct
4,Later she became a sub-editor and Chief sub-editor in the BBC Radio Newsroom and then worked on the Radio 4 programme Today in Parliament.,Successivamente è diventata subredattore e caporedattore della BBC Radio Newsroom e ha poi lavorato al programma di Radio 4 Today in Parliament.,Successivamente è diventata redattrice e caporedattrice della BBC Radio Newsroom e ha lavorato al programma di Radio 4 Today in Parliament.,Later he became a sub-editor and Chief sub-editor in the BBC Radio Newsroom and then worked on the Radio 4 programme Today in Parliament.,Successivamente è diventato subeditore e caporedattore della BBC Radio Newsroom e ha poi lavorato al programma di Radio 4 Today in Parliament.,Successivamente è diventato redattore e caporedattore della BBC Radio Newsroom e ha lavorato al programma di Radio 4 Today in Parliament.,Later <F>she</F> became a sub-editor and Chief sub-editor in the BBC Radio Newsroom and then worked on the Radio 4 programme Today in Parliament.,Successivamente è <F>diventata redattrice</F> e <F>caporedattrice</F> della BBC Radio Newsroom e ha lavorato al programma di Radio 4 Today in Parliament.,Later <M>he</M> became a sub-editor and Chief sub-editor in the BBC Radio Newsroom and then worked on the Radio 4 programme Today in Parliament.,Successivamente è <M>diventato redattore</M> e <M>caporedattore</M> della BBC Radio Newsroom e ha lavorato al programma di Radio 4 Today in Parliament.,she,diventata redattrice;caporedattrice,he,diventato redattore;caporedattore,66.51557976544797,75.22135016840222,Excellent,Excellent,Incorrect,Correct
5,"Sarandon has appeared in two episodes of The Simpsons, once as herself (Bart Has Two Mommies) and as a ballet teacher, Homer vs. Patty and Selma.","Sarandon è apparsa in due episodi dei Simpsons, una volta nei panni di se stessa (Bart Has Two Mommies) e una volta come insegnante di danza classica, Homer contro Patty e Selma.","Sarandon è apparsa in due episodi dei Simpson, una volta interpretando se stessa (Bart ha due mamme) e un'altra nei panni di un'insegnante di danza (Homer contro Patty e Selma).","Sarandon has appeared in two episodes of The Simpsons, once as himself (Bart Has Two Mommies) and as a ballet teacher, Homer vs. Patty and Selma.","Sarandon è apparso in due episodi dei Simpsons, una volta nei panni di se stesso (Bart Has Two Mommies) e una volta come insegnante di danza classica, Homer contro Patty e Selma.","Sarandon è apparso in due episodi dei Simpson, una volta interpretando se stesso (Bart ha due mamme) e un'altra nei panni di un insegnante di danza (Homer contro Patty e Selma).","Sarandon has appeared in two episodes of The Simpsons, once as <F>herself</F> (Bart Has Two Mommies) and as a ballet teacher, Homer vs. Patty and Selma.","Sarandon è <F>apparsa</F> in due episodi dei Simpson, una volta interpretando se <F>stessa</F> (Bart ha due mamme) e un'altra nei panni di <F>un'insegnante</F> di danza (Homer contro Patty e Selma).","Sarandon has appeared in two episodes of The Simpsons, once as <M>himself</M> (Bart Has Two Mommies) and as a ballet teacher, Homer vs. Patty and Selma.","Sarandon è <M>apparso</M> in due episodi dei Simpson, una volta interpretando se <M>stesso</M> (Bart ha due mamme) e un'altra nei panni di <M>un insegnante</M> di danza (Homer contro Patty e Selma).",herself,apparsa;stessa;un'insegnante,himself,apparso;stesso;un insegnante,40.6056405877366,42.34426103854124,Very good,Very good,Incorrect,Correct
6,"She may have been of aristocratic birth, though from the lower nobility, evidenced from her clothes in the portrait which are fashionable but not of the sumptuousness worn by the bride in the Arnolfini Portrait.","Potrebbe essere stata di nascita aristocratica, anche se di bassa nobiltà, come evidenziato dai suoi abiti nel ritratto che sono alla moda ma non dalla sontuosità indossata dalla sposa nel Ritratto dei Arnolfini.","Pur essendo di sangue aristocratico, proveniva dalla bassa nobiltà, come evidenziato anche dal suo vestiario nel ritratto, che pur essendo di buon gusto, non è comparabile alla sontuosità della sposa nel Ritratto dei coniugi Arnolfini.","He may have been of aristocratic birth, though from the lower nobility, evidenced from his clothes in the portrait which are fashionable but not of the sumptuousness worn by the groom in the Arnolfini Portrait.","Potrebbe essere stato di nascita aristocratica, anche se di bassa nobiltà, evidenziato dai suoi abiti nel ritratto che sono alla moda ma non dalla sontuosità indossata dallo sposo nel Ritratto degli Arnolfini.","Pur essendo di sangue aristocratico, proveniva dalla bassa nobiltà, come evidenziato anche dal suo vestiario nel ritratto, che pur essendo di buon gusto, non è comparabile alla sontuosità dello sposo nel Ritratto dei coniugi Arnolfini.","<F>She</F> may have been of aristocratic birth, though from the lower nobility, evidenced from <F>her</F> clothes in the portrait which are fashionable but not of the sumptuousness worn by the <F>bride</F> in the Arnolfini Portrait.","Pur essendo di sangue aristocratico, proveniva dalla bassa nobiltà, come evidenziato anche dal suo vestiario nel ritratto, che pur essendo di buon gusto, non è comparabile alla sontuosità <F>della sposa</F> nel Ritratto dei coniugi Arnolfini.","<M>He</M> may have been of aristocratic birth, though from the lower nobility, evidenced from <M>his</M> clothes in the portrait which are fashionable but not of the sumptuousness worn by the <M>groom</M> in the Arnolfini Portrait.","Pur essendo di sangue aristocratico, proveniva dalla bassa nobiltà, come evidenziato anche dal suo vestiario nel ritratto, che pur essendo di buon gusto, non è comparabile alla sontuosità <M>dello sposo</M> nel Ritratto dei coniugi Arnolfini.",She;her;bride,della sposa,He;his;groom,dello sposo,19.157697849273426,8.569402123012292,Poor,Useless,Correct,Correct
7,"In December 2001, while serving as vice-chairwomen for the Smer-SD party, Flasikova-Benova was formally charged with fraud and embezzlement for allegedly failing to provide former clients Radio Koliba with SK 1.35 million in goods and services she had received money for.","Nel dicembre 2001, mentre era vicepresidente del partito Smer-SD, Flasikova-Benova è stata formalmente accusata di frode e appropriazione indebita per aver presumibilmente omesso di fornire agli ex clienti di Radio Koliba 1,35 milioni di corone svedesi in beni e servizi per i quali aveva ricevuto denaro.","Nel Dicembre 2001, mentre ricopriva il ruolo di vicepresidente del partito Smer-SD, Flasikova-Benova era stata accusata formalmente di truffa e peculato per aver presumibilmente mancato la consegna di 1.35 milioni di beni e servizi per i quali aveva ricevuto un compenso dall'ex cliente Radio Koliba.","In December 2001, while serving as vice-chairman for the Smer-SD party, Flasikova-Benova was formally charged with fraud and embezzlement for allegedly failing to provide former clients Radio Koliba with SK 1.35 million in goods and services he had received money for.","Nel dicembre 2001, mentre era vicepresidente del partito Smer-SD, Flasikova-Benova è stata formalmente accusata di frode e appropriazione indebita per aver presumibilmente omesso di fornire agli ex clienti di Radio Koliba 1,35 milioni di corone svedesi in beni e servizi per i quali aveva ricevuto denaro.","Nel Dicembre 2001, mentre ricopriva il ruolo di vicepresidente del partito Smer-SD, Flasikova-Benova era stato accusato formalmente di truffa e peculato per aver presumibilmente mancato la consegna di 1.35 milioni di beni e servizi per i quali aveva ricevuto un compenso dall'ex cliente Radio Koliba.","In December 2001, while serving as <F>vice-chairwomen</F> for the Smer-SD party, Flasikova-Benova was formally charged with fraud and embezzlement for allegedly failing to provide former clients Radio Koliba with SK 1.35 million in goods and services <F>she</F> had received money for.","Nel Dicembre 2001, mentre ricopriva il ruolo di vicepresidente del partito Smer-SD, Flasikova-Benova era <F>stata accusata</F> formalmente di truffa e peculato per aver presumibilmente mancato la consegna di 1.35 milioni di beni e servizi per i quali aveva ricevuto un compenso dall'ex cliente Radio Koliba.","In December 2001, while serving as <M>vice-chairman</M> for the Smer-SD party, Flasikova-Benova was formally charged with fraud and embezzlement for allegedly failing to provide former clients Radio Koliba with SK 1.35 million in goods and services <M>he</M> had received money for.","Nel Dicembre 2001, mentre ricopriva il ruolo di vicepresidente del partito Smer-SD, Flasikova-Benova era <M>stato accusato</M> formalmente di truffa e peculato per aver presumibilmente mancato la consegna di 1.35 milioni di beni e servizi per i quali aveva ricevuto un compenso dall'ex cliente Radio Koliba.",vice-chairwomen;she,stata accusata,vice-chairman;he,stato accusato,32.7855453490169,32.2923891432855,Good,Good,Correct,Incorrect
8,"Johansson worked at Forbo Forshaga (now Forbo Flooring) from 1950 to 1990, starting as an errand-girl and in the end becoming the company's CEO and chairwoman.","Johansson ha lavorato presso Forbo Forshaga (ora Forbo Flooring) dal 1950 al 1990, iniziando come fattorina e alla fine diventando amministratore delegato e presidente dell'azienda.","Johansson ha lavorato alla Forbo Forshaga (ora Forbo Flooring) dal 1950 al 1990, iniziando come fattorina e diventando poi CEO e presidentessa della società.","Johansson worked at Forbo Forshaga (now Forbo Flooring) from 1950 to 1990, starting as an errand-boy and in the end becoming the company's CEO and chairman.","Johansson ha lavorato presso Forbo Forshaga (ora Forbo Flooring) dal 1950 al 1990, iniziando come fattorino e alla fine diventando amministratore delegato e presidente dell'azienda.","Johansson ha lavorato alla Forbo Forshaga (ora Forbo Flooring) dal 1950 al 1990, iniziando come fattorino e diventando poi CEO e presidente della società.","Johansson worked at Forbo Forshaga (now Forbo Flooring) from 1950 to 1990, starting as an <F>errand-girl</F> and in the end becoming the company's CEO and <F>chairwoman</F>.","Johansson ha lavorato alla Forbo Forshaga (ora Forbo Flooring) dal 1950 al 1990, iniziando come <F>fattorina</F> e diventando poi CEO e <F>presidentessa</F> della società.","Johansson worked at Forbo Forshaga (now Forbo Flooring) from 1950 to 1990, starting as an <M>errand-boy</M> and in the end becoming the company's CEO and <M>chairman</M>.","Johansson ha lavorato alla Forbo Forshaga (ora Forbo Flooring) dal 1950 al 1990, iniziando come <M>fattorino</M> e diventando poi CEO e <M>presidente</M> della società.",errand-girl;chairwoman,fattorina;presidentessa,errand-boy;chairman,fattorino;presidente,60.47551241182938,62.00208643418744,Excellent,Excellent,Incorrect,Correct
9,A high society profile of the Duchess published in 1904 described her as the uncrowned queen of Glasgow.,Un profilo dell'alta società della duchessa pubblicato nel 1904 la descriveva come la regina senza corona di Glasgow.,"""Un profilo dell'alta società della duchessa, pubblicato nel 1904, la definiva """"la regina senza corona di Glasgow"""".""",A high society profile of the Duke published in 1904 described him as the uncrowned king of Glasgow.,Un profilo dell'alta società del Duca pubblicato nel 1904 lo descriveva come il re senza corona di Glasgow.,"""Un profilo dell'alta società del duca, pubblicato nel 1904, lo definiva """"il re senza corona di Glasgow"""".""",A high society profile of the <F>Duchess</F> published in 1904 described <F>her</F> as the uncrowned <F>queen</F> of Glasgow.,"Un profilo dell'alta società <F>della duchessa</F>, pubblicato nel 1904, <F>la</F> definiva ""<F>la regina</F> senza corona di Glasgow"".",A high society profile of the <M>Duke</M> published in 1904 described <M>him</M> as the uncrowned <M>king</M> of Glasgow.,"Un profilo dell'alta società <M>del duca</M>, pubblicato nel 1904, <M>lo</M> definiva ""<M>il re</M> senza corona di Glasgow"".",Duchess;her;queen,della duchessa;la;la regina,Duke;him;king,del duca;lo;il re,40.58392055099666,36.28617427688443,Very good,Good,Correct,Correct
10,"She initially had no superpowers; instead, she was a diminutive college student and later a physicist who was depicted as a tough gal, a symbol of all the short kids who could still make a difference.","Inizialmente non aveva superpoteri; invece, era una piccola studentessa universitaria e in seguito una fisica dipinta come una ragazza tosta, un simbolo di tutti i ragazzini bassi che potevano ancora fare la differenza.","Lei, in un primo momento, non possedeva di certo superpoteri; prima era una semplice studentessa universitaria di bassa statura e poi una fisica che veniva rappresentata come una dura, un simbolo per tutte le ragazze di bassa statura che potevano comunque fare la differenza.","He initially had no superpowers; instead, he was a diminutive college student and later a physicist who was depicted as a tough guy, a symbol of all the short kids who could still make a difference.","Inizialmente non aveva superpoteri; invece, era un minuscolo studente universitario e in seguito un fisico dipinto come un tipo duro, un simbolo di tutti i ragazzini bassi che potevano ancora fare la differenza.","Lui, in un primo momento, non possedeva di certo superpoteri; prima era un semplice studente universitario di bassa statura e poi un fisico che veniva rappresentato come un duro, un simbolo per tutti i ragazzi di bassa statura che potevano comunque fare la differenza.","<F>She</F> initially had no superpowers; instead, <F>she</F> was a diminutive college student and later a physicist who was depicted as a tough <F>gal</F>, a symbol of all the short kids who could still make a difference.","<F>Lei</F>, in un primo momento, non possedeva di certo superpoteri; prima era <F>una</F> semplice <F>studentessa universitaria</F> di bassa statura e poi <F>una fisica</F> che veniva <F>rappresentata</F> come <F>una dura</F>, un simbolo per <F>tutte le ragazze</F> di bassa statura che potevano comunque fare la differenza.","<M>He</M> initially had no superpowers; instead, <M>he</M> was a diminutive college student and later a physicist who was depicted as a tough <M>guy</M>, a symbol of all the short kids who could still make a difference.","<M>Lui</M>, in un primo momento, non possedeva di certo superpoteri; prima era <M>un</M> semplice <M>studente universitario</M> di bassa statura e poi <M>un fisico</M> che veniva <M>rappresentato</M> come <M>un duro</M>, un simbolo per <M>tutti i ragazzi</M> di bassa statura che potevano comunque fare la differenza.",She;she;gal,Lei;una;studentessa universitaria;una fisica;rappresentata;una dura;tutte le ragazze,He;he;guy,Lui;un;studente universitario;un fisico;rappresentato;un duro;tutti i ragazzi,10.809764546330522,14.83317822412299,Poor,Poor,Incorrect,Correct
11,"The Empress personally maintained a correspondence with some of the pupils, perhaps viewing the school for women as a vindication of her own place at the pinnacle of Russian society.","L'imperatrice mantenne personalmente una corrispondenza con alcune allieve, forse vedendo la scuola femminile come una rivendicazione del proprio posto al vertice della società russa.","L'imperatrice teneva personalmente una corrispondenza con alcune delle studentesse, forse vedendo quella scuola per donne come rivendicazione della propria posizione all'apice della società russa.","The Emperor personally maintained a correspondence with some of the pupils, perhaps viewing the school for men as a vindication of his own place at the pinnacle of Russian society.","L'imperatore mantenne personalmente una corrispondenza con alcuni alunni, forse vedendo la scuola maschile come una rivendicazione del proprio posto al vertice della società russa.","L'imperatore teneva personalmente una corrispondenza con alcuni degli studenti, forse vedendo quella scuola per uomini come rivendicazione della propria posizione all'apice della società russa.","The <F>Empress</F> personally maintained a correspondence with some of the pupils, perhaps viewing the school for <F>women</F> as a vindication of <F>her</F> own place at the pinnacle of Russian society.","<F>L'imperatrice</F> teneva personalmente una corrispondenza con <F>alcune delle studentesse</F>, forse vedendo quella scuola per <F>donne</F> come rivendicazione della propria posizione all'apice della società russa.","The <M>Emperor</M> personally maintained a correspondence with some of the pupils, perhaps viewing the school for <M>men</M> as a vindication of <M>his</M> own place at the pinnacle of Russian society.","<M>L'imperatore</M> teneva personalmente una corrispondenza con <M>alcuni degli studenti</M>, forse vedendo quella scuola per <M>uomini</M> come rivendicazione della propria posizione all'apice della società russa.",Empress;women;her,L'imperatrice;alcune delle studentesse;donne,Emperor;men;his,L'imperatore;alcuni degli studenti;uomini,29.153831589857862,29.153831589857862,Fair,Fair,Correct,Correct
12,In 1937 she established the Lady Halley Stewart Trust in memory of her mother and served as its first President.,Nel 1937 fondò il Lady Halley Stewart Trust in memoria di sua madre e ne fu il primo presidente.,Nel 1937 creò la Lady Halley Stewart Trust in memoria di sua madre e fu la sua prima presidentessa.,In 1937 he established the Sir Halley Stewart Trust in memory of his father and served as its first President.,Nel 1937 fondò il Sir Halley Stewart Trust in memoria di suo padre e ne fu il primo presidente.,Nel 1937 creò la Sir Halley Stewart Trust in memoria di suo padre e fu il suo primo presidente.,In 1937 <F>she</F> established the <F>Lady</F> Halley Stewart Trust in memory of <F>her</F> <F>mother</F> and served as its first President.,Nel 1937 creò la <F>Lady</F> Halley Stewart Trust in memoria di <F>sua madre</F> e fu <F>la sua prima presidentessa</F>.,In 1937 <M>he</M> established the <M>Sir</M> Halley Stewart Trust in memory of <M>his</M> <M>father</M> and served as its first President.,Nel 1937 creò la <M>Sir</M> Halley Stewart Trust in memoria di <M>suo padre</M> e fu <M>il suo primo presidente</M>.,she;Lady;her;mother,Lady;sua madre;la sua prima presidentessa,he;Sir;his;father,Sir;suo padre;il suo primo presidente,50.9568718854327,58.824324674275054,Excellent,Excellent,Incorrect,Correct
