orig_id,source_feminine,translate_feminine,reference_feminine,source_masculine,translate_masculine,reference_masculine,source_feminine_annotated,reference_feminine_annotated,source_masculine_annotated,reference_masculine_annotated,source_feminine_keywords,reference_feminine_keywords,source_masculine_keywords,reference_masculine_keywords,scores_f_bleu,scores_m_bleu,f_quality_bins,m_quality_bins,decision_f,decision_m
129,"Later, she worked as Nagaram Agriculture Market Committee Chairwoman (AMC Chairwoman) twice apart from that served as Vice-President of Rice Millors Association in East Godavari District.","Successivamente, ha lavorato due volte come presidente del comitato del mercato agricolo di Nagaram (presidente dell'AMC), oltre a ricoprire il ruolo di vicepresidente dell'associazione dei produttori di riso nel distretto di Godavari orientale.","Successivamente, lavorò come Presidentessa della Nagaram Agriculture Market Committee (Presidente AMC) due volte a parte quando ha lavorato come Vice presidentessa della Rice Millors Association nel distretto di East Godavari.","Later, he worked as Nagaram Agriculture Market Committee Chairman (AMC Chairman) twice apart from that served as Vice-President of Rice Millors Association in East Godavari District.","Successivamente, ha lavorato due volte come presidente del comitato del mercato agricolo di Nagaram (presidente dell'AMC), oltre a ricoprire il ruolo di vicepresidente dell'associazione dei produttori di riso nel distretto di Godavari orientale.","Successivamente, lavorò come Presidente della Nagaram Agriculture Market Committee (Presidente AMC) due volte a parte quando ha lavorato come Vice presidente della Rice Millors Association nel distretto di East Godavari.","Later, <F>she</F> worked as Nagaram Agriculture Market Committee <F>Chairwoman</F> (AMC <F>Chairwoman</F>) twice apart from that served as Vice-President of Rice Millors Association in East Godavari District.","Successivamente, lavorò come <F>Presidentessa</F> della Nagaram Agriculture Market Committee (Presidente AMC) due volte a parte quando ha lavorato come Vice <F>presidentessa</F> della Rice Millors Association nel distretto di East Godavari.","Later, <M>he</M> worked as Nagaram Agriculture Market Committee <M>Chairman</M> (AMC <M>Chairman</M>) twice apart from that served as Vice-President of Rice Millors Association in East Godavari District.","Successivamente, lavorò come <M>Presidente</M> della Nagaram Agriculture Market Committee (Presidente AMC) due volte a parte quando ha lavorato come Vice <M>presidente</M> della Rice Millors Association nel distretto di East Godavari.",she;Chairwoman;Chairwoman,Presidentessa;presidentessa,he;Chairman;Chairman,Presidente;presidente,6.893281774601135,6.998553164398772,Useless,Useless,Incorrect,Correct
130,"She returned home and helped her parents manage a hotel and taught in two mountain schools before accepting a position to be director of music at a Methodist school for girls in Huzhou (now Wuxing, Zhejiang), China.","Tornò a casa e aiutò i suoi genitori a gestire un albergo e insegnò in due scuole di montagna prima di accettare un posto come direttrice musicale presso una scuola metodista femminile a Huzhou (ora Wuxing, Zhejiang), in Cina.","Tornò a casa, aiutò i suoi genitori a gestire un hotel e insegnò in due scuole di montagna prima di accettare la posizione di direttrice musicale alla scuola Metodista per ragazze di Huzhou (ora Wuxing, Zhejiang), in Cina.","He returned home and helped his parents manage a hotel and taught in two mountain schools before accepting a position to be director of music at a Methodist school for boys in Huzhou (now Wuxing, Zhejiang), China.","Tornò a casa e aiutò i suoi genitori a gestire un albergo e insegnò in due scuole di montagna prima di accettare l'incarico di direttore musicale presso una scuola metodista per ragazzi a Huzhou (ora Wuxing, Zhejiang), Cina.","Tornò a casa, aiutò i suoi genitori a gestire un hotel e insegnò in due scuole di montagna prima di accettare la posizione di direttore musicale alla scuola Metodista per ragazzi di Huzhou (ora Wuxing, Zhejiang), in Cina.","<F>She</F> returned home and helped <F>her</F> parents manage a hotel and taught in two mountain schools before accepting a position to be director of music at a Methodist school for <F>girls</F> in Huzhou (now Wuxing, Zhejiang), China.","Tornò a casa, aiutò i suoi genitori a gestire un hotel e insegnò in due scuole di montagna prima di accettare la posizione di <F>direttrice</F> musicale alla scuola Metodista per <F>ragazze</F> di Huzhou (ora Wuxing, Zhejiang), in Cina.","<M>He</M> returned home and helped <M>his</M> parents manage a hotel and taught in two mountain schools before accepting a position to be director of music at a Methodist school for <M>boys</M> in Huzhou (now Wuxing, Zhejiang), China.","Tornò a casa, aiutò i suoi genitori a gestire un hotel e insegnò in due scuole di montagna prima di accettare la posizione di <M>direttore</M> musicale alla scuola Metodista per <M>ragazzi</M> di Huzhou (ora Wuxing, Zhejiang), in Cina.",She;her;girls,direttrice;ragazze,He;his;boys,direttore;ragazzi,59.777951252207465,56.81456452119741,Excellent,Excellent,Correct,Correct
131,"Herman then moved to Austin, TX in 1989 where she started a private practice in child & adolescent psychiatry and was recruited to be Medical Director of Charter Hospital of Austin, She subsequently served in leadership positions at a number of free-standing psychiatric hospitals in the area.","Herman si è poi trasferita ad Austin, in Texas, nel 1989, dove ha avviato uno studio privato di psichiatria infantile e adolescenziale ed è stata reclutata come direttore medico del Charter Hospital di Austin. Successivamente ha ricoperto posizioni di leadership in numerosi ospedali psichiatrici indipendenti negli Stati Uniti. zona.","Herman quindi si è trasferita ad Austin, in Texas nel 1989 dove ha cominciato privatamente a lavorare come psichiatra per bambini ed adolescenti e fu assunta come direttrice sanitaria del Charter Hospital di Austin, e successivamente ha ricoperto posizioni dirigenziali in diversi ospedali psichiatrci indipendenti in zona.","Herman then moved to Austin, TX in 1989 where he started a private practice in child & adolescent psychiatry and was recruited to be Medical Director of Charter Hospital of Austin, He subsequently served in leadership positions at a number of free-standing psychiatric hospitals in the area.","Herman si è poi trasferito ad Austin, in Texas, nel 1989, dove ha avviato uno studio privato di psichiatria infantile e adolescenziale ed è stato reclutato come direttore medico del Charter Hospital di Austin. Successivamente ha ricoperto posizioni di leadership in numerosi ospedali psichiatrici indipendenti negli Stati Uniti. zona.","Herman quindi si è trasferito ad Austin, in Texas nel 1989 dove ha cominciato privatamente a lavorare come psichiatra per bambini ed adolescenti e fu assunto come direttore sanitario del Charter Hospital di Austin, e successivamente ha ricoperto posizioni dirigenziali in diversi ospedali psichiatrci indipendenti in zona.","Herman then moved to Austin, TX in 1989 where <F>she</F> started a private practice in child & adolescent psychiatry and was recruited to be Medical Director of Charter Hospital of Austin, <F>She</F> subsequently served in leadership positions at a number of free-standing psychiatric hospitals in the area.","Herman quindi si è <F>trasferita</F> ad Austin, in Texas nel 1989 dove ha cominciato privatamente a lavorare come psichiatra per bambini ed adolescenti e fu <F>assunta</F> come <F>direttrice sanitaria</F> del Charter Hospital di Austin, e successivamente ha ricoperto posizioni dirigenziali in diversi ospedali psichiatrci indipendenti in zona.","Herman then moved to Austin, TX in 1989 where <M>he</M> started a private practice in child & adolescent psychiatry and was recruited to be Medical Director of Charter Hospital of Austin, <M>He</M> subsequently served in leadership positions at a number of free-standing psychiatric hospitals in the area.","Herman quindi si è <M>trasferito</M> ad Austin, in Texas nel 1989 dove ha cominciato privatamente a lavorare come psichiatra per bambini ed adolescenti e fu <M>assunto</M> come <M>direttore sanitario</M> del Charter Hospital di Austin, e successivamente ha ricoperto posizioni dirigenziali in diversi ospedali psichiatrci indipendenti in zona.",she;She,trasferita;assunta;direttrice sanitaria,he;He,trasferito;assunto;direttore sanitario,21.655050988024406,22.18842630263286,Fair,Fair,Incorrect,Correct
132,In 1921 she was appointed professor in charge of the newly created Department of Anthropology at the University of Calcutta but she retired in 1926 due to ill health and loss of vision.,"Nel 1921 fu nominata professoressa responsabile del neonato Dipartimento di Antropologia dell'Università di Calcutta, ma si ritirò nel 1926 a causa di problemi di salute e perdita della vista.",Nel 1921 fu nominata professoressa in carica del nuovo dipartimento di antropologia dell'Univerity of Calcutta ma si licenziò nel 1926 a causa di problemi di salute e mancanza di visione.,In 1921 he was appointed professor in charge of the newly created Department of Anthropology at the University of Calcutta but he retired in 1926 due to ill health and loss of vision.,Nel 1921 fu nominato professore responsabile del neonato Dipartimento di Antropologia dell'Università di Calcutta ma si ritirò nel 1926 a causa di problemi di salute e perdita della vista.,Nel 1921 fu nominato professore in carica del nuovo dipartimento di antropologia dell'Univerity of Calcutta ma si licenziò nel 1926 a causa di problemi di salute e mancanza di visione.,In 1921 <F>she</F> was appointed professor in charge of the newly created Department of Anthropology at the University of Calcutta but <F>she</F> retired in 1926 due to ill health and loss of vision.,Nel 1921 fu <F>nominata professoressa</F> in carica del nuovo dipartimento di antropologia dell'Univerity of Calcutta ma si licenziò nel 1926 a causa di problemi di salute e mancanza di visione.,In 1921 <M>he</M> was appointed professor in charge of the newly created Department of Anthropology at the University of Calcutta but <M>he</M> retired in 1926 due to ill health and loss of vision.,Nel 1921 fu <M>nominato professore</M> in carica del nuovo dipartimento di antropologia dell'Univerity of Calcutta ma si licenziò nel 1926 a causa di problemi di salute e mancanza di visione.,she;she,nominata professoressa,he;he,nominato professore,41.23855261385295,43.07455067573056,Very good,Very good,Correct,Correct
133,She is currently a Professor of Clinical Radiology at UCSD and division chief of vascular and interventional radiology.,Attualmente è professoressa di radiologia clinica presso l'UCSD e capo divisione di radiologia vascolare e interventistica.,Attualmente è professoressa di radiologia clinica presso la UCSD ed è capo dipartimento di angiochirurgia vascolare e interventistica.,He is currently a Professor of Clinical Radiology at UCSD and division chief of vascular and interventional radiology.,Attualmente è professore di radiologia clinica presso l'UCSD e capo divisione di radiologia vascolare e interventistica.,Attualmente è professore di radiologia clinica presso la UCSD ed è capo dipartimento di angiochirurgia vascolare e interventistica.,<F>She</F> is currently a Professor of Clinical Radiology at UCSD and division chief of vascular and interventional radiology.,Attualmente è <F>professoressa</F> di radiologia clinica presso la UCSD ed è capo dipartimento di angiochirurgia vascolare e interventistica.,<M>He</M> is currently a Professor of Clinical Radiology at UCSD and division chief of vascular and interventional radiology.,Attualmente è <M>professore</M> di radiologia clinica presso la UCSD ed è capo dipartimento di angiochirurgia vascolare e interventistica.,She,professoressa,He,professore,46.00160223062214,46.00160223062214,Very good,Very good,Correct,Correct
134,"Her multicultural background and upbringing in Boston, Washington, D.C., and Queens, New York, influenced her development into what The New Yorker termed a multicultural mynah bird [who] lays our mongrel nation before us with gorgeous, pitch-perfect impersonations of the rarely heard or dramatized.","Il suo background multiculturale e la sua educazione a Boston, Washington, D.C., e nel Queens, a New York, hanno influenzato il suo sviluppo in quello che il New Yorker ha definito un uccello mynah multiculturale [che] presenta la nostra nazione bastarda davanti a noi con splendide, perfette imitazioni di rarità. ascoltato o drammatizzato.","""Il suo background multiculturale e l'educazione ricevuta a Boston, Washington, D.C., e nel Queens a New York, hanno influenzato la sua trasformazione in quella che il New Yorker ha definito """"una merla multiculturale, che mette a nudo la natura meticcia della nostra nazione con splendide, perfette impersonificazioni di coloro che raramente vengono ascoltati o rappresentati"""".""","His multicultural background and upbringing in Boston, Washington, D.C., and Queens, New York, influenced his development into what The New Yorker termed a multicultural mynah bird [who] lays our mongrel nation before us with gorgeous, pitch-perfect impersonations of the rarely heard or dramatized.","Il suo background multiculturale e la sua educazione a Boston, Washington, D.C. e nel Queens, a New York, hanno influenzato il suo sviluppo in quello che il New Yorker ha definito un uccello mynah multiculturale [che] presenta la nostra nazione bastarda davanti a noi con splendide, perfette imitazioni di rarità. ascoltato o drammatizzato.","""Il suo background multiculturale e l'educazione ricevuta a Boston, Washington, D.C., e nel Queens a New York, hanno influenzato la sua trasformazione in quello che il New Yorker ha definito """"un merlo multiculturale, che mette a nudo la natura meticcia della nostra nazione con splendide, perfette impersonificazioni di coloro che raramente vengono ascoltati o rappresentati"""".""","<F>Her</F> multicultural background and upbringing in Boston, Washington, D.C., and Queens, New York, influenced <F>her</F> development into what The New Yorker termed a multicultural mynah bird [who] lays our mongrel nation before us with gorgeous, pitch-perfect impersonations of the rarely heard or dramatized.","Il suo background multiculturale e l'educazione ricevuta a Boston, Washington, D.C., e nel Queens a New York, hanno influenzato la sua trasformazione in <F>quella</F> che il New Yorker ha definito ""<F>una merla</F> multiculturale, che mette a nudo la natura meticcia della nostra nazione con splendide, perfette impersonificazioni di coloro che raramente vengono ascoltati o rappresentati"".","<M>His</M> multicultural background and upbringing in Boston, Washington, D.C., and Queens, New York, influenced <M>his</M> development into what The New Yorker termed a multicultural mynah bird [who] lays our mongrel nation before us with gorgeous, pitch-perfect impersonations of the rarely heard or dramatized.","Il suo background multiculturale e l'educazione ricevuta a Boston, Washington, D.C., e nel Queens a New York, hanno influenzato la sua trasformazione in <M>quello</M> che il New Yorker ha definito ""<M>un merlo</M> multiculturale, che mette a nudo la natura meticcia della nostra nazione con splendide, perfette impersonificazioni di coloro che raramente vengono ascoltati o rappresentati"".",Her;her,quella;una merla,His;his,quello;un merlo,41.04030196838639,39.664301291235695,Very good,Good,Incorrect,Correct
135,"As the deputy chairwoman, Ikoku argued that Abacha was free to succeed herself if the political parties agree to draft her as their presidential candidate.","In qualità di vicepresidente, Ikoku ha sostenuto che Abacha era libera di succedere a se stessa se i partiti politici avessero accettato di arruolarla come loro candidata presidenziale.","Come vice presidentessa, Ikoku sostenne che Abacha era libera di affermarsi se i partiti politici fossero stati d'accordo a selezionarla come loro candidata alla presidenza.","As the deputy chairman, Ikoku argued that Abacha was free to succeed himself if the political parties agree to draft him as their presidential candidate.","In qualità di vicepresidente, Ikoku ha sostenuto che Abacha era libero di succedere a se stesso se i partiti politici avessero accettato di arruolarlo come loro candidato presidenziale.","Come vice presidente, Ikoku sostenne che Abacha era libero di affermarsi se i partiti politici fossero stati d'accordo a selezionarlo come loro candidato alla presidenza.","As the deputy <F>chairwoman</F>, Ikoku argued that Abacha was free to succeed <F>herself</F> if the political parties agree to draft <F>her</F> as their presidential candidate.","Come vice <F>presidentessa</F>, Ikoku sostenne che Abacha era <F>libera</F> di affermarsi se i partiti politici fossero stati d'accordo a <F>selezionarla</F> come loro <F>candidata</F> alla presidenza.","As the deputy <M>chairman</M>, Ikoku argued that Abacha was free to succeed <M>himself</M> if the political parties agree to draft <M>him</M> as their presidential candidate.","Come vice <M>presidente</M>, Ikoku sostenne che Abacha era <M>libero</M> di affermarsi se i partiti politici fossero stati d'accordo a <M>selezionarlo</M> come loro <M>candidato</M> alla presidenza.",chairwoman;herself;her,presidentessa;libera;selezionarla;candidata,chairman;himself;him,presidente;libero;selezionarlo;candidato,25.72396203245696,25.72396203245696,Fair,Fair,Correct,Correct
136,"She founded the Empress Menen School for Girls in Addis Ababa, the first all-girls school which had both boarding and day students.","Ha fondato la Empress Menen School for Girls ad Addis Abeba, la prima scuola femminile che aveva sia collegio che studenti diurni.","Ad Addis Abeba ha fondato la Empress Menen School for Girls, la prima scuola interamente femminile che ospitava studentesse sia del collegio che della scuola diurna.","He founded the Empress Menen School for Boys in Addis Ababa, the first all-boys school which had both boarding and day students.","Ha fondato l'Imperatrice Menen School for Boys ad Addis Abeba, la prima scuola maschile che aveva sia studenti in collegio che diurni.","Ad Addis Abeba ha fondato la Empress Menen School for Boys, la prima scuola interamente maschile che ospitava studenti sia del collegio che della scuola diurna.","<F>She</F> founded the Empress Menen School for <F>Girls</F> in Addis Ababa, the first all-<F>girls</F> school which had both boarding and day students.","Ad Addis Abeba ha fondato la Empress Menen School for <F>Girls</F>, la prima scuola interamente <F>femminile</F> che ospitava <F>studentesse</F> sia del collegio che della scuola diurna.","<M>He</M> founded the Empress Menen School for <M>Boys</M> in Addis Ababa, the first all-<M>boys</M> school which had both boarding and day students.","Ad Addis Abeba ha fondato la Empress Menen School for <M>Boys</M>, la prima scuola interamente <M>maschile</M> che ospitava <M>studenti</M> sia del collegio che della scuola diurna.",She;Girls;girls,Girls;femminile;studentesse,He;Boys;boys,Boys;maschile;studenti,35.6018893326879,22.600787576975232,Good,Fair,Incorrect,Correct
137,"The ladies imitated the queen: they endeavored to have the Jews considered an inalienable dependence of their fiefs, and to establish the usage that if a Jew domiciled in one barony passed into another, the lady of her former domicil should have the right to seize her possessions.","Le dame imitarono la regina: cercarono di far considerare gli ebrei una dipendenza inalienabile dei loro feudi, e di stabilire l'uso che se un ebreo domiciliato in una baronia passava in un'altra, la dama del suo antico domicilio avesse il diritto di impossessarsene. possedimenti.","Le signore imitarono la regina: cercarono di far considerare gli ebrei come strettamente dipendenti ai feudi d'appartenenza, e di stabilire la prassi che se un'ebrea domiciliata in una baronia si trasferiva in un'altra, la signora del precedente domicilio doveva avere il diritto di confiscare i suoi beni.","The lords imitated the king: they endeavored to have the Jews considered an inalienable dependence of their fiefs, and to establish the usage that if a Jew domiciled in one barony passed into another, the lord of his former domicil should have the right to seize his possessions.","I signori imitarono il re: cercarono di far considerare gli ebrei una dipendenza inalienabile dei loro feudi, e di stabilire l'uso che se un ebreo domiciliato in una baronia passava in un'altra, il signore del suo precedente domicilio avesse il diritto di impossessarsi della sua possedimenti.","I signori imitarono il re: cercarono di far considerare gli ebrei come strettamente dipendenti ai feudi d'appartenenza, e di stabilire la prassi che se un ebreo domiciliato in una baronia si trasferiva in un'altra, il signore del precedente domicilio doveva avere il diritto di confiscare i suoi beni.","The <F>ladies</F> imitated the <F>queen</F>: they endeavored to have the Jews considered an inalienable dependence of their fiefs, and to establish the usage that if a Jew domiciled in one barony passed into another, the <F>lady</F> of <F>her</F> former domicil should have the right to seize <F>her</F> possessions.","<F>Le signore</F> imitarono <F>la regina</F>: cercarono di far considerare gli ebrei come strettamente dipendenti ai feudi d'appartenenza, e di stabilire la prassi che se <F>un'ebrea domiciliata</F> in una baronia si trasferiva in un'altra, <F>la signora</F> del precedente domicilio doveva avere il diritto di confiscare i suoi beni.","The <M>lords</M> imitated the <M>king</M>: they endeavored to have the Jews considered an inalienable dependence of their fiefs, and to establish the usage that if a Jew domiciled in one barony passed into another, the <M>lord</M> of <M>his</M> former domicil should have the right to seize <M>his</M> possessions.","<M>I signori</M> imitarono <M>il re</M>: cercarono di far considerare gli ebrei come strettamente dipendenti ai feudi d'appartenenza, e di stabilire la prassi che se <M>un ebreo domiciliato</M> in una baronia si trasferiva in un'altra, <M>il signore</M> del precedente domicilio doveva avere il diritto di confiscare i suoi beni.",ladies;queen;lady;her;her,Le signore;la regina;un'ebrea domiciliata;la signora,lords;king;lord;his;his,I signori;il re;un ebreo domiciliato;il signore,33.79799999189128,51.156631703348864,Good,Excellent,Incorrect,Correct
138,"She was also a recognized speaker in the United States and Canada, and her insights were quoted by women in business authors.",Era anche un'oratrice riconosciuta negli Stati Uniti e in Canada e le sue intuizioni sono state citate da autrici di donne in affari.,"Era anche una relatrice riconosciuta negli Stati Uniti e in Canada, e le sue idee erano menzionate da autrici donne d'affari.","He was also a recognized speaker in the United States and Canada, and his insights were quoted by men in business authors.",Era anche un oratore riconosciuto negli Stati Uniti e in Canada e le sue intuizioni sono state citate da autori di uomini d'affari.,"Era anche un relatore riconosciuto negli Stati Uniti e in Canada, e le sue idee erano menzionate da autori uomini d'affari.","<F>She</F> was also a recognized speaker in the United States and Canada, and <F>her</F> insights were quoted by <F>women</F> in business authors.","Era anche <F>una relatrice riconosciuta</F> negli Stati Uniti e in Canada, e le sue idee erano menzionate da <F>autrici donne</F> d'affari.","<M>He</M> was also a recognized speaker in the United States and Canada, and <M>his</M> insights were quoted by <M>men</M> in business authors.","Era anche <M>un relatore riconosciuto</M> negli Stati Uniti e in Canada, e le sue idee erano menzionate da <M>autori uomini</M> d'affari.",She;her;women,una relatrice riconosciuta;autrici donne,He;his;men,un relatore riconosciuto;autori uomini,35.02979072560522,41.39483879150052,Good,Very good,Correct,Correct
